339,339,Jonathan W Pillow,UT Austin,Jonathan W Pillow,UT Austin,Partially View-aligned Clustering.
340,340,Novi Quadrianto,University of Sussex and HSE,Dale Schuurmans,Google Brain & University of Alberta,MeshSDF: Differentiable Iso-Surface Extraction.
341,341,Theodore Perkins,Ottawa Hospital Research Institute,Theodore Perkins,Ottawa Hospital Research Institute,Joint Policy Search for Multi-agent Collaboration with Imperfect Information.
342,342,Xiao-Ming Wu,Columbia University,Shuo-Yen Robert Li,None,On Infinite-Width Hypernetworks.
343,343,Bharath Sriperumbudur,The Pennsylvania State University,Bernhard Schölkopf,"MPI for Intelligent Systems, Tübingen",Training Generative Adversarial Networks with Limited Data.
344,344,Hamed Pirsiavash,University of California Irvine,Charless Fowlkes,UC Irvine,Reinforcement Learning with Combinatorial Actions: An Application to Vehicle Routing.
345,345,HongJing Lu,UCLA,Alan L Yuille,UCLA,A Self-Tuning Actor-Critic Algorithm.
346,346,Guillermo Cecchi,IBM Research,Jean-Baptiste Poline,CEA-INSERM,Residual Force Control for Agile Human Behavior Imitation and Extended Motion Synthesis.
347,347,Arkadas Ozakin,Georgia Institute of Technology,Alexander Gray,Skytree Inc. and Georgia Tech,"See, Hear, Explore: Curiosity via Audio-Visual Association."
348,348,Robert Legenstein,Graz University of Technology,Wolfgang Maass,Graz University of Technology,Finite-Time Analysis for Double Q-learning.
349,349,Joao V Graca,L2F INESC-ID Lisboa,Fernando Pereira,Google,Adaptive Discretization for Model-Based Reinforcement Learning.
350,350,Sundeep Rangan,Qualcomm,Vivek K Goyal,Massachusetts Institute of Technology,Object Goal Navigation using Goal-Oriented Semantic Exploration.
351,351,Kate Saenko,UMass Lowell,Trevor Darrell,UC Berkeley,Online Algorithms for Multi-shop Ski Rental with Machine Learned Advice.
352,352,Yee Whye Teh,"University of Oxford, DeepMind",DILAN Gorur,DeepMind,Planning in Markov Decision Processes with Gap-Dependent Sample Complexity.
353,353,Shuai Huang,Arizona State University,Jieping Ye,Arizona State University,A new convergent variant of Q-learning with linear function approximation.
354,354,Joao V Graca,L2F INESC-ID Lisboa,Fernando Pereira,Google,A Unified Switching System Perspective and Convergence Analysis of Q-Learning Algorithms.
355,355,Andrea Montanari,Stanford,José Bento,Boston College,Adversarially Robust Streaming Algorithms via Differential Privacy.
356,356,Bing Bai,NEC Labs America,Mehryar Mohri,Google Research & Courant Institute of Mathematical Sciences,Generalized Boosting.
357,357,Paris Smaragdis,University of Illinois Urbana-Champaign,Bhiksha Raj,Carnegie Mellon University,A Topological Filter for Learning with Label Noise.
358,358,Mario J Fritz,MPI Informatics,Trevor Darrell,UC Berkeley,Learning by Minimizing the Sum of Ranked Range.
