259,259,Taehwan Kim,TTI-Chicago,Raquel Urtasun,University of Toronto,Sparse Coding for Learning Interpretable Spatio-Temporal Primitives.
260,260,John Duchi,UC Berkeley,Martin J Wainwright,UC Berkeley,Distributed Dual Averaging In Networks.
261,261,Stefan Harmeling,Heinrich-Heine-Universität Düsseldorf,Bernhard Schölkopf,"MPI for Intelligent Systems, Tübingen",Space-Variant Single-Image Blind Deconvolution for Removing Camera Shake.
262,262,Gowtham Bellala,"University of Michigan, Ann Arbor",Clay Scott,University of Michigan,Extensions of Generalized Binary Search to Group Identification and Exponential Costs.
263,263,Matthew D. Hoffman,Google,Francis Bach,INRIA - Ecole Normale Superieure,Online Learning for Latent Dirichlet Allocation.
264,264,Pranjal Awasthi,Princeton,Reza Zadeh,Matroid,Supervised Clustering.
265,265,Nicholas K Fisher,University of Florida,Arunava Banerjee,University of Florida,A Novel Kernel for Learning a Neuron Model from Spike Train Data.
266,266,Alex Kulesza,Google,Ben Taskar,University of Washington,Structured Determinantal Point Processes.
267,267,Leonid Karlinsky,Weizmann Institute of Science,Shimon Ullman,Weizmann Institute of Science,Using body-anchored priors for identifying actions in single images.
268,268,Zeeshan Syed,University of Michigan,John Guttag,Massachusetts Institute of Technology,Identifying Patients at Risk of Major Adverse Cardiovascular Events Using Symbolic Mismatch.
269,269,Yi Zhang,Carnegie Mellon University,Jeff Schneider,CMU,Learning Multiple Tasks with a Sparse Matrix-Normal Penalty.
270,270,Hugo Larochelle,Twitter,Geoffrey E Hinton,Google & University of Toronto,Learning to combine foveal glimpses with a third-order Boltzmann machine.
271,271,Bela A Frigyik,University of Washington,Yihua Chen,University of Washington,Shadow Dirichlet for Restricted Probability Modeling.
272,272,Emanuel Todorov,University of Washington,Emanuel Todorov,University of Washington,Policy gradients in linearly-solvable MDPs.
273,273,Ryan Adams,Princeton University,Michael Jordan,UC Berkeley,Tree-Structured Stick Breaking for Hierarchical Data.
274,274,Yu Zhang,Hong Kong Baptist University,Dit-Yan Yeung,Hong Kong University of Science and Technology,Worst-Case Linear Discriminant Analysis.
275,275,Uwe Dick,University of Potsdam,Tobias Scheffer,Universität Potsdam,Throttling Poisson Processes.
276,276,Sivan Sabato,Ben Gurion University,Naftali Tishby,The Hebrew University Jerusalem,Tight Sample Complexity of Large-Margin Learning.
277,277,David C Lee,Carnegie Mellon University,Takeo Kanade,Carnegie Mellon University,Estimating Spatial Layout of Rooms using Volumetric Reasoning about Objects and Surfaces.
278,278,Jun Liu,Siemens Corporate Research,Jieping Ye,Arizona State University,Moreau-Yosida Regularization for Grouped Tree Structure Learning.
