,year,first-author,first-author-affiliation,last-author,last-author-affiliation,journal/conference,title,number-of-authors,paper-url,DBLP-url
1052,2021,Zihan Liu,nan,Pascale Fung,Hong Kong University of Science and Technology,AAAI,CrossNER - Evaluating Cross-Domain Named Entity Recognition.,8,https://ojs.aaai.org/index.php/AAAI/article/view/17587,https://dblp.org/rec/conf/aaai/Liu0YDJCMF21
1053,2021,Longxiang Liu,nan,Xiang Zhou 0007,CloudWalk Technology,AAAI,Filling the Gap of Utterance-aware and Speaker-aware Representation for Multi-turn Dialogue.,5,https://ojs.aaai.org/index.php/AAAI/article/view/17582,https://dblp.org/rec/conf/aaai/Liu0ZZ021
1054,2021,Ping Liu,nan,Mustafa Bilgic 0001,"Illinois Institute of Technology, Chicago, IL, USA",AAAI,Relational Classification of Biological Cells in Microscopy Images.,2,https://ojs.aaai.org/index.php/AAAI/article/view/16110,https://dblp.org/rec/conf/aaai/LiuB21
1055,2021,Bingyan Liu,nan,Xiangqun Chen,nan,AAAI,TransTailor - Pruning the Pre-trained Model for Improved Transfer Learning.,4,https://ojs.aaai.org/index.php/AAAI/article/view/17046,https://dblp.org/rec/conf/aaai/LiuC0C21
1056,2021,Hanmeng Liu,nan,Yue Zhang 0004,"Westlake University, School of Engineering, Hangzhou, China",AAAI,Natural Language Inference in Context - Investigating Contextual Reasoning over Long Texts.,4,https://ojs.aaai.org/index.php/AAAI/article/view/17580,https://dblp.org/rec/conf/aaai/LiuCL021
1057,2021,Yang Liu,nan,Feng Liang,nan,AAAI,Reinforcement Learning-based Product Delivery Frequency Control.,6,https://ojs.aaai.org/index.php/AAAI/article/view/17803,https://dblp.org/rec/conf/aaai/LiuCVWWL21
1058,2019,Philip Amortila,nan,Doina Precup,"McGill University, Montreal, Canada",SafeAI@AAAI,Temporally Extended Metrics for Markov Decision Processes.,4,http://ceur-ws.org/Vol-2301/paper_30.pdf,https://dblp.org/rec/conf/aaai/AmortilaBPP19
1059,2019,Katja Auernhammer,nan,Markus Zoppelt,nan,SafeAI@AAAI,Attacks on Machine Learning - Lurking Danger for Accountability.,3,http://ceur-ws.org/Vol-2301/paper_2.pdf,https://dblp.org/rec/conf/aaai/AuernhammerKZ19
1060,2019,Alec Banks,nan,Rob Ashmore,nan,SafeAI@AAAI,Requirements Assurance in Machine Learning.,2,http://ceur-ws.org/Vol-2301/paper_8.pdf,https://dblp.org/rec/conf/aaai/BanksA19
1061,2019,Vahid Behzadan,nan,Arslan Munir,"Kansas State University, Manhattan, KS, USA",SafeAI@AAAI,Emergence of Addictive Behaviors in Reinforcement Learning Agents.,3,http://ceur-ws.org/Vol-2301/paper_31.pdf,https://dblp.org/rec/conf/aaai/BehzadanYM19
1062,2019,Bryant Chen,nan,Biplav Srivastava,nan,SafeAI@AAAI,Detecting Backdoor Attacks on Deep Neural Networks by Activation Clustering.,8,http://ceur-ws.org/Vol-2301/paper_18.pdf,https://dblp.org/rec/conf/aaai/ChenCBLELMS19
1063,2019,Bence Cserna,nan,Wheeler Ruml,"University of New Hampshire, USA",SafeAI@AAAI,Safe Temporal Planning for Urban Driving.,4,http://ceur-ws.org/Vol-2301/paper_34.pdf,https://dblp.org/rec/conf/aaai/CsernaDGR19
1064,2019,Peter Eckersley,nan,Peter Eckersley,nan,SafeAI@AAAI,Impossibility and Uncertainty Theorems in AI Value Alignment (or why your AGI should not have a utility function).,1,http://ceur-ws.org/Vol-2301/paper_7.pdf,https://dblp.org/rec/conf/aaai/Eckersley19
1065,2019,José Hernández-Orallo,"Polytechnic University of Valencia, Spain",Seán Ó hÉigeartaigh,"University of Cambridge, Centre for the Study of Existential Risk, UK",SafeAI@AAAI,Surveying Safety-relevant AI Characteristics.,4,http://ceur-ws.org/Vol-2301/paper_22.pdf,https://dblp.org/rec/conf/aaai/Hernandez-Orallo19
1066,2019,Lê Nguyên Hoang,nan,Lê Nguyên Hoang,nan,SafeAI@AAAI,Towards Robust End-to-End Alignment.,1,http://ceur-ws.org/Vol-2301/paper_1.pdf,https://dblp.org/rec/conf/aaai/Hoang19
1067,2019,Philip Koopman,"Carnegie Mellon University, Pittsburgh, USA",Frank Fratrik,nan,SafeAI@AAAI,"How Many Operational Design Domains, Objects, and Events?",2,http://ceur-ws.org/Vol-2301/paper_6.pdf,https://dblp.org/rec/conf/aaai/KoopmanF19
1068,2019,Tao Li 0019,"Purdue University, Department of Computer Science, West Lafayette, Indiana, USA",Siyuan Gong,nan,SafeAI@AAAI,AutoMPC - Efficient Multi-Party Computation for Secure and Privacy-Preserving Cooperative Control of Connected Autonomous Vehicles.,3,http://ceur-ws.org/Vol-2301/paper_13.pdf,https://dblp.org/rec/conf/aaai/LiLG19
1069,2019,Xin Liu,nan,Hai Li 0001,"Duke University, Department of Electrical and Computer Engineering",SafeAI@AAAI,DPATCH - An Adversarial Patch Attack on Object Detectors.,6,http://ceur-ws.org/Vol-2301/paper_5.pdf,https://dblp.org/rec/conf/aaai/LiuYLSCL19
1070,2019,Shih-Yun Lo,nan,Peter Stone,"University of Texas at Austin, USA",SafeAI@AAAI,Robust Motion Planning and Safety Benchmarking in Human Workspaces.,3,http://ceur-ws.org/Vol-2301/paper_28.pdf,https://dblp.org/rec/conf/aaai/LoAS19
1071,2019,Saasha Nair,nan,Alois C. Knoll,"Technical University Munich, Department of Computer Science, Germany",SafeAI@AAAI,Monitoring Safety of Autonomous Vehicles with Crash Prediction Networks.,5,http://ceur-ws.org/Vol-2301/paper_12.pdf,https://dblp.org/rec/conf/aaai/NairSKOK19
1072,2019,Saerom Park,nan,Junyoung Byun,nan,SafeAI@AAAI,Security-preserving Support Vector Machine with Fully Homomorphic Encryption.,6,http://ceur-ws.org/Vol-2301/paper_35.pdf,https://dblp.org/rec/conf/aaai/Park0CLKB19
1073,2019,Mark Riedl,"Georgia Institute of Technology, Atlanta, USA",Brent Harrison,nan,SafeAI@AAAI,Enter the Matrix - Safely Interruptible Autonomous Systems via Virtualization.,2,http://ceur-ws.org/Vol-2301/paper_3.pdf,https://dblp.org/rec/conf/aaai/RiedlH19
1074,2019,Frank Rudzicz,"University of Toronto, Canada",Marta Janczarski,nan,SafeAI@AAAI,Towards international standards for evaluating machine learning.,3,http://ceur-ws.org/Vol-2301/paper_10.pdf,https://dblp.org/rec/conf/aaai/RudziczPJ19
1075,2019,Sandhya Saisubramanian,nan,Shlomo Zilberstein,"University of Massachusetts Amherst, USA",SafeAI@AAAI,Minimizing the Negative Side Effects of Planning with Reduced Models.,2,http://ceur-ws.org/Vol-2301/paper_32.pdf,https://dblp.org/rec/conf/aaai/SaisubramanianZ19
1076,2019,Gopal P. Sarma,nan,Nick J. Hay,nan,SafeAI@AAAI,"Integrative Biological Simulation, Neuropsychology, and AI Safety.",3,http://ceur-ws.org/Vol-2301/paper_21.pdf,https://dblp.org/rec/conf/aaai/SarmaSH19
1077,2019,Kacper Sokol,nan,Peter A. Flach,"University of Bristol, Department of Computer Science, UK",SafeAI@AAAI,Counterfactual Explanations of Machine Learning Predictions - Opportunities and Challenges for AI Safety.,2,http://ceur-ws.org/Vol-2301/paper_20.pdf,https://dblp.org/rec/conf/aaai/SokolF19
1078,2019,Huanrui Yang,nan,Hai Li 0001,"Duke University, Department of Electrical and Computer Engineering",SafeAI@AAAI,Bamboo - Ball-Shape Data Augmentation Against Adversarial Attacks from All Directions.,6,http://ceur-ws.org/Vol-2301/paper_33.pdf,https://dblp.org/rec/conf/aaai/YangZCWCL19
1079,2019,Yi Zeng,nan,Cunqing Huangfu,nan,SafeAI@AAAI,Linking Artificial Intelligence Principles.,3,http://ceur-ws.org/Vol-2301/paper_15.pdf,https://dblp.org/rec/conf/aaai/ZengLH19
1080,2019,Huáscar Espinoza,nan,Mauricio Castillo-Effen,Universidad Católica Boliviana,SafeAI,"Workshop on Artificial Intelligence Safety 2019 co-located with the Thirty-Third AAAI Conference on Artificial Intelligence 2019 (AAAI-19), Honolulu, Hawaii, January 27, 2019.",5,http://ceur-ws.org/Vol-2301,https://dblp.org/rec/conf/aaai/2019safeai
1081,2020,Nikhil Vyas 0001,"Massachusetts Institute of Technology, CSAIL, Cambridge, MA, USA",Ryan Williams 0001,"MIT, CSAIL, USA",AAAI,Results on a Super Strong Exponential Time Hypothesis.,2,https://aaai.org/ojs/index.php/AAAI/article/view/7125,https://dblp.org/rec/conf/aaai/0001020
1082,2020,Minghao Chen 0001,"Zhejiang University, Hangzhou, China",Deng Cai 0001,"Zhejiang University, College of Computer Science, State Key Laboratory of CAD&CG, Hangzhou, China",AAAI,Adversarial-Learned Loss for Domain Adaptation.,4,https://aaai.org/ojs/index.php/AAAI/article/view/5757,https://dblp.org/rec/conf/aaai/00010LC20
1083,2020,Sameer Singh 0001,"University of California, Irvine, CA, USA",Sameer Singh 0001,"University of California, Irvine, CA, USA",AAAI,Minecraft as a Platform for Project-Based Learning in AI.,1,https://aaai.org/ojs/index.php/AAAI/article/view/7070,https://dblp.org/rec/conf/aaai/000120
1084,2020,David Kempe 0001,"University of Southern California, Los Angeles, USA",David Kempe 0001,"University of Southern California, Los Angeles, USA",AAAI,An Analysis Framework for Metric Voting based on LP Duality.,1,https://aaai.org/ojs/index.php/AAAI/article/view/5581,https://dblp.org/rec/conf/aaai/000120a
1085,2020,David Kempe 0001,"University of Southern California, Los Angeles, USA",David Kempe 0001,"University of Southern California, Los Angeles, USA",AAAI,"Communication, Distortion, and Randomness in Metric Voting.",1,https://aaai.org/ojs/index.php/AAAI/article/view/5582,https://dblp.org/rec/conf/aaai/000120b
1086,2020,Jan Maly 0001,"TU Wien, Austria",Jan Maly 0001,"TU Wien, Austria",AAAI,Lifting Preferences over Alternatives to Preferences over Sets of Alternatives - The Complexity of Recognizing Desirable Families of Sets.,1,https://aaai.org/ojs/index.php/AAAI/article/view/5590,https://dblp.org/rec/conf/aaai/000120c
1087,2020,Richa Singh 0001,"IIT Jodhpur, India",Mayank Vatsa,"IIT Jodhpur, India",AAAI,On the Robustness of Face Recognition Algorithms Against Attacks and Bias.,5,https://aaai.org/ojs/index.php/AAAI/article/view/7085,https://dblp.org/rec/conf/aaai/0001ASNV20
1088,2020,Chao Qian 0001,钱 超,Chao Feng,nan,AAAI,Subset Selection by Pareto Optimization with Recombination.,3,https://aaai.org/ojs/index.php/AAAI/article/view/5621,https://dblp.org/rec/conf/aaai/0001BF20
1089,2020,Haris Aziz 0001,"NICTA, Sydney",Toby Walsh,"University of New South Wales, Sydney, Australia",AAAI,Facility Location Problem with Capacity Constraints - Algorithmic and Mechanism Design Perspectives.,5,https://aaai.org/ojs/index.php/AAAI/article/view/5547,https://dblp.org/rec/conf/aaai/0001CL0W20
1090,2020,Yuan Ye 0001,"Northeastern University, China",Dongyan Zhao 0001,"Peking University, Institute of Computer Science and Technology, China",AAAI,Integrating Relation Constraints with Neural Relation Extractors.,5,https://aaai.org/ojs/index.php/AAAI/article/view/6487,https://dblp.org/rec/conf/aaai/0001FLL020
1091,2020,Stephen Mayhew 0001,"University of Pennsylvania, Department of Computer and Information Science, Philadelphia, PA, USA",Dan Roth,"University of Illinois, USA",AAAI,Robust Named Entity Recognition with Truecasing Pretraining.,3,https://aaai.org/ojs/index.php/AAAI/article/view/6368,https://dblp.org/rec/conf/aaai/0001GR20
1092,2020,Jian Yin 0001,"Sun Yat-Sen University, School of Data and Computer Science, Guangzhou, China",Zhi-Jie Wang,王志傑,AAAI,A Novel Model for Imbalanced Data Classification.,6,https://aaai.org/ojs/index.php/AAAI/article/view/6145,https://dblp.org/rec/conf/aaai/0001GZLQW20
1093,2020,Xiaofeng Liu 0001,"Carnegie Mellon University, Pittsburgh, USA",Jun Lu,nan,AAAI,Importance-Aware Semantic Segmentation in Self-Driving with Discrete Wasserstein Training.,9,https://aaai.org/ojs/index.php/AAAI/article/view/6831,https://dblp.org/rec/conf/aaai/0001HBGWHLYL20
1094,2020,Siddharth Bhatia 0001,National University of Singapore,Christos Faloutsos,"Carnegie Mellon University, Pittsburgh, USA",AAAI,Midas - Microcluster-Based Detector of Anomalies in Edge Streams.,5,https://aaai.org/ojs/index.php/AAAI/article/view/5724,https://dblp.org/rec/conf/aaai/0001HYSF20
1095,2020,Claudia Schulz 0001,"Babylon Health, London, UK",Damir Juric,nan,AAAI,Can Embeddings Adequately Represent Medical Terminology? New Large-Scale Medical Term Similarity Datasets Have the Answer!,2,https://aaai.org/ojs/index.php/AAAI/article/view/6404,https://dblp.org/rec/conf/aaai/0001J20
1096,2020,Yanli Liu 0001,"Wuhan University of Science and Technology, Wuhan, China",Kun He 0001,何琨,AAAI,A Learning Based Branch and Bound for Maximum Common Subgraph Related Problems.,4,https://aaai.org/ojs/index.php/AAAI/article/view/5619,https://dblp.org/rec/conf/aaai/0001LJ020
1097,2020,Gaurav Pandey 0001,"IBM Research AI, New Delhi, India",Sachindra Joshi,nan,AAAI,Mask & Focus - Conversation Modelling by Learning Concepts.,3,https://aaai.org/ojs/index.php/AAAI/article/view/6381,https://dblp.org/rec/conf/aaai/0001RJ20
1098,2020,Sijia Liu 0001,"IBM Research, MIT-IBM Watson AI Lab, Cambridge, MA, USA",Alexander G. Gray,"College of Computing, Georgia Institute of Technology",AAAI,An ADMM Based Framework for AutoML Pipeline Configuration.,9,https://aaai.org/ojs/index.php/AAAI/article/view/5926,https://dblp.org/rec/conf/aaai/0001RV0BSW0G20
1099,2020,Michael Katz 0001,"IBM Thomas J. Watson Research Center, Yorktown Heights, NY, USA",Shirin Sohrabi,nan,AAAI,Reshaping Diverse Planning.,2,https://aaai.org/ojs/index.php/AAAI/article/view/6543,https://dblp.org/rec/conf/aaai/0001S20
1100,2020,Tong Yu 0001,"Samsung Research America, Mountain View, CA, USA",Hongxia Jin,nan,AAAI,Towards Hands-Free Visual Dialog Interactive Recommendation.,3,https://aaai.org/ojs/index.php/AAAI/article/view/5465,https://dblp.org/rec/conf/aaai/0001SJ20
1101,2020,Vivek Gupta 0001,"University of Utah, School of Computing, Salt Lake City, UT, USA",Partha P. Talukdar,"Indian Institute of Science, Bangalore",AAAI,P-SIF - Document Embeddings Using Partition Averaging.,6,https://aaai.org/ojs/index.php/AAAI/article/view/6292,https://dblp.org/rec/conf/aaai/0001SNNRT20
1102,2020,Yuhang Song 0001,"University of Oxford, Department of Computer Science, Oxford, UK",Lianlong Wu,nan,AAAI,Arena - A General Evaluation Platform and Building Toolkit for Multi-Agent Intelligence.,9,https://aaai.org/ojs/index.php/AAAI/article/view/6216,https://dblp.org/rec/conf/aaai/0001WLWAXXDW20
1103,2020,Yuhang Song 0001,"University of Oxford, Department of Computer Science, Oxford, UK",Mai Xu,nan,AAAI,Mega-Reward - Achieving Human-Level Play without Extrinsic Rewards.,7,https://aaai.org/ojs/index.php/AAAI/article/view/6040,https://dblp.org/rec/conf/aaai/0001WLXZWX20
1104,2020,Zhe Wu 0001,"University of Maryland, College Park, MD, USA",Larry S. Davis,"University of Maryland, College Park, MD, USA",AAAI,Recognizing Instagram Filtered Images with Feature De-Stylization.,4,https://aaai.org/ojs/index.php/AAAI/article/view/6928,https://dblp.org/rec/conf/aaai/0001WSD20
1105,2020,Zhuosheng Zhang 0001,"Shanghai Jiao Tong University, Shanghai, China",Rui Wang 0015,王瑞,AAAI,SG-Net - Syntax-Guided Machine Reading Comprehension.,6,https://aaai.org/ojs/index.php/AAAI/article/view/6511,https://dblp.org/rec/conf/aaai/0001WZDZ020
1106,2020,Zhuosheng Zhang 0001,"Shanghai Jiao Tong University, Shanghai, China",Xiang Zhou 0007,CloudWalk Technology,AAAI,Semantics-Aware BERT for Language Understanding.,7,https://aaai.org/ojs/index.php/AAAI/article/view/6510,https://dblp.org/rec/conf/aaai/0001WZLZZZ20
1107,2020,Zhining Liu 0001,"University of Electronic Science and Technology of China, Chengdu, China",Jingrui He,nan,AAAI,Towards Fine-Grained Temporal Network Representation via Time-Reinforced Random Walk.,5,https://aaai.org/ojs/index.php/AAAI/article/view/5936,https://dblp.org/rec/conf/aaai/0001ZZGH20
1108,2020,Aditya Modi 0002,"University of Michigan, Ann Arbor, MI, USA",Eric Horvitz,Microsoft Research,AAAI,Metareasoning in Modular Software Systems - On-the-Fly Configuration Using Reinforcement Learning with Rich Contextual Representations.,7,https://aaai.org/ojs/index.php/AAAI/article/view/5965,https://dblp.org/rec/conf/aaai/0002DASNAH20
1109,2020,Radu Marinescu 0002,"IBM Research, Dublin, Ireland",Adi Botea,nan,AAAI,Parallel AND/OR Search for Marginal MAP.,3,https://aaai.org/ojs/index.php/AAAI/article/view/6584,https://dblp.org/rec/conf/aaai/0002KB20
1110,2020,Lu Chen 0002,"Shanghai Jiao Tong University, Department of Computer Science and Engineering, China",Kai Yu 0004,"Shanghai Jiao Tong University, Computer Science and Engineering Department, China",AAAI,Schema-Guided Multi-Domain Dialogue State Tracking with Graph Attention Neural Networks.,6,https://aaai.org/ojs/index.php/AAAI/article/view/6250,https://dblp.org/rec/conf/aaai/0002LWZT020
1111,2020,Shubham Agarwal 0002,IBM Research,Yasaman Khazaeni,nan,AAAI,TraceHub - A Platform to Bridge the Gap between State-of-the-Art Time-Series Analytics and Datasets.,7,https://aaai.org/ojs/index.php/AAAI/article/view/7087,https://dblp.org/rec/conf/aaai/0002MAUTZK20
1112,2020,Kun Qian 0002,"IBM Almaden Research Center, USA",Lucian Popa 0001,"IBM Almaden Research Center, San Jose, CA, USA",AAAI,PARTNER - Human-in-the-Loop Entity Name Understanding with Deep Learning.,4,https://aaai.org/ojs/index.php/AAAI/article/view/7104,https://dblp.org/rec/conf/aaai/0002RL020
1113,2020,Chen Qian 0003,"Tsinghua University, Beijing, China",Tat-Seng Chua,nan,AAAI,Solving Sequential Text Classification as Board-Game Playing.,7,https://aaai.org/ojs/index.php/AAAI/article/view/6388,https://dblp.org/rec/conf/aaai/0003FWCLZC20
1114,2020,Zhiyuan Liu 0003,"University of Colorado, Boulder, CO, USA",Lijun Chen,nan,AAAI,Incentivized Exploration for Multi-Armed Bandits under Reward Drift.,5,https://aaai.org/ojs/index.php/AAAI/article/view/5937,https://dblp.org/rec/conf/aaai/0003WSLC20
1115,2020,Tian Tan 0003,"Stanford University, Center for Sustainable Development and Global Competitiveness, CA, USA",Vikranth R. Dwaracherla,nan,AAAI,Parameterized Indexed Value Function for Efficient Exploration in Reinforcement Learning.,3,https://aaai.org/ojs/index.php/AAAI/article/view/6055,https://dblp.org/rec/conf/aaai/0003XD20
1116,2020,Liang Xie 0003,"Zhejiang University, State Key Lab of CAD&CG, Hangzhou, China",Xiaofei He 0001,"Zhejiang University, State Key Lab of CAD&CG, China",AAAI,PI-RCNN - An Efficient Multi-Sensor 3D Object Detector with Point-Based Attentive Cont-Conv Fusion Module.,7,https://aaai.org/ojs/index.php/AAAI/article/view/6933,https://dblp.org/rec/conf/aaai/0003XYXYC020
1117,2020,Youmin Zhang 0005,"Beihang University, Beijing, China",Kuiyuan Yang,nan,AAAI,Adaptive Unimodal Cost Volume Filtering for Deep Stereo Matching.,7,https://aaai.org/ojs/index.php/AAAI/article/view/6991,https://dblp.org/rec/conf/aaai/0005C0YYLY20
1118,2020,Xiaodong Yang 0005,"Chinese Academy of Sciences, Institute of Computing Technology, China",Ruizhe Sun,nan,AAAI,Instance-Wise Dynamic Sensor Selection for Human Activity Recognition.,6,https://aaai.org/ojs/index.php/AAAI/article/view/5461,https://dblp.org/rec/conf/aaai/0005CYZLS20
1119,2020,Shuo Chen 0006,"Nanyang Technological University, School of Computer Science and Engineering, Singapore",Jie Zhang 0002,"Nanyang Technological University, School of Computer Engineering, Singapore",AAAI,AATEAM - Achieving the Ad Hoc Teamwork by Employing the Attention Mechanism.,4,https://aaai.org/ojs/index.php/AAAI/article/view/6196,https://dblp.org/rec/conf/aaai/0006ACZ20
1120,2020,Yiming Gao 0006,"Zhejiang University, College of Computer Science, Hangzhou, China",Jiangqin Wu,nan,AAAI,GAN-Based Unpaired Chinese Character Image Translation via Skeleton Transformation and Stroke Rendering.,2,https://aaai.org/ojs/index.php/AAAI/article/view/5405,https://dblp.org/rec/conf/aaai/0006W20
1121,2020,Heng Zhang 0006,"Tianjin University, School of Computer Software, China",Guifei Jiang,nan,AAAI,Towards Universal Languages for Tractable Ontology Mediated Query Answering.,5,https://aaai.org/ojs/index.php/AAAI/article/view/5699,https://dblp.org/rec/conf/aaai/0006ZY0J20
1122,2020,Ning Liu 0007,"Northeastern University, Boston, MA, USA",Jieping Ye,nan,AAAI,AutoCompress - An Automatic DNN Structured Pruning Framework for Ultra-High Compression Rates.,6,https://aaai.org/ojs/index.php/AAAI/article/view/5924,https://dblp.org/rec/conf/aaai/0007MXW0Y20
1123,2020,Shuang Li 0008,"Tsinghua University, Department of Automation, Beijing, China",Jian Tang 0008,"Syracuse University, Department of Electrical Engineering and Computer Science, NY, USA",AAAI,Domain Conditioned Adaptation Network.,7,https://aaai.org/ojs/index.php/AAAI/article/view/6801,https://dblp.org/rec/conf/aaai/0008LLXDHT20
1124,2020,Shan Jiang 0008,"Northeastern University, MA, USA",Christo Wilson,nan,AAAI,Reasoning about Political Bias in Content Moderation.,3,https://aaai.org/ojs/index.php/AAAI/article/view/7117,https://dblp.org/rec/conf/aaai/0008RW20
1125,2020,Ning Xu 0009,"Southeast University, School of Computer Science and Engineering, MOE Key Laboratory of Computer Network and Information Integration, Nanjing, China",Xin Geng,nan,AAAI,Partial Multi-Label Learning with Label Distribution.,3,https://aaai.org/ojs/index.php/AAAI/article/view/6124,https://dblp.org/rec/conf/aaai/0009LG20
1126,2020,Shuai Li 0010,李帅,Kwong-Sak Leung,Chinese University of Hong Kong,AAAI,Stochastic Online Learning with Probabilistic Graph Feedback.,4,https://aaai.org/ojs/index.php/AAAI/article/view/5899,https://dblp.org/rec/conf/aaai/0010CWL20
1127,2020,Jun Wang 0010,"Sichuan University, College of Electronics And Information Engineering, Chengdu, China",Hanqing Tao,nan,AAAI,Crowdfunding Dynamics Tracking - A Reinforcement Learning Approach.,5,https://aaai.org/ojs/index.php/AAAI/article/view/6087,https://dblp.org/rec/conf/aaai/0010ZLPT20
1128,2020,Jing Zhang 0015,"Nanjing University of Science and Technology, School of Computer Science and Engineering, China",Victor S. Sheng,nan,AAAI,Interactive Learning with Proactive Cognition Enhancement for Crowd Workers.,4,https://aaai.org/ojs/index.php/AAAI/article/view/5392,https://dblp.org/rec/conf/aaai/0015WMS20
1129,2020,Jingyan Wang 0001,"Carnegie Mellon University, PA, USA",Nihar B. Shah,nan,AAAI,Ranking and Rating Rankings and Ratings.,2,https://aaai.org/ojs/index.php/AAAI/article/view/7126,https://dblp.org/rec/conf/aaai/001S20
1130,2020,Yong Liu 0020,"Nanyang Technological University, Singapore",Haihong Tang,nan,AAAI,Diversified Interactive Recommendation with Implicit Feedback.,7,https://aaai.org/ojs/index.php/AAAI/article/view/5931,https://dblp.org/rec/conf/aaai/0020X0MZZT20
1131,2020,Xiang Li 0041,"Momenta, China",Jian Yang 0003,"Nanjing University of Science and Technology, School of Computer Science and Engineering, China",AAAI,Understanding the Disharmony between Weight Normalization Family and Weight Decay.,3,https://aaai.org/ojs/index.php/AAAI/article/view/5904,https://dblp.org/rec/conf/aaai/00280020
1132,2020,Qi Zhang 0038,"University of Michigan, Ann Arbor, MI, USA",Satinder Singh,nan,AAAI,Modeling Probabilistic Commitments for Maintenance Is Inherently Harder than for Achievement.,3,https://aaai.org/ojs/index.php/AAAI/article/view/6596,https://dblp.org/rec/conf/aaai/0038DS20
1133,2020,Lei Zhang 0054,"Inception Institute of Artificial Intelligence, United Arab Emirates",Yanning Zhang,nan,AAAI,Pixel-Aware Deep Function-Mixture Network for Spectral Super-Resolution.,7,https://aaai.org/ojs/index.php/AAAI/article/view/6978,https://dblp.org/rec/conf/aaai/0054LW0L0Z20
1134,2020,Ralph Abboud,nan,Thomas Lukasiewicz,"University of Oxford, UK",AAAI,Learning to Reason - Leveraging Neural Networks for Approximate DNF Counting.,3,https://aaai.org/ojs/index.php/AAAI/article/view/5705,https://dblp.org/rec/conf/aaai/AbboudCL20
1135,2020,Afshin Abdi,nan,Faramarz Fekri,"Georgia Institute of Technology, Atlanta, USA",AAAI,Quantized Compressive Sampling of Stochastic Gradients for Efficient Communication in Distributed Deep Learning.,2,https://aaai.org/ojs/index.php/AAAI/article/view/5706,https://dblp.org/rec/conf/aaai/AbdiF20
1136,2020,Afshin Abdi,nan,Faramarz Fekri,"Georgia Institute of Technology, Atlanta, USA",AAAI,Indirect Stochastic Gradient Quantization and Its Application in Distributed Deep Learning.,2,https://aaai.org/ojs/index.php/AAAI/article/view/5707,https://dblp.org/rec/conf/aaai/AbdiF20a
1137,2020,Rediet Abebe,nan,S. Matthew Weinberg,"Princeton University, NJ, USA",AAAI,Subsidy Allocations in the Presence of Income Shocks.,3,https://aaai.org/ojs/index.php/AAAI/article/view/6188,https://dblp.org/rec/conf/aaai/AbebeKW20
1138,2020,Erman Acar,nan,Reshef Meir,nan,AAAI,Distance-Based Equilibria in Normal-Form Games.,2,https://aaai.org/ojs/index.php/AAAI/article/view/5540,https://dblp.org/rec/conf/aaai/AcarM20
1139,2020,Rupam Acharyya,nan,Md. Iftekhar Tanveer,University of Rochester,AAAI,FairyTED - A Fair Rating Predictor for TED Talk Data.,4,https://aaai.org/ojs/index.php/AAAI/article/view/5368,https://dblp.org/rec/conf/aaai/AcharyyaDCT20
1140,2020,Sravanti Addepalli,nan,Venkatesh Babu Radhakrishnan,nan,AAAI,DeGAN - Data-Enriching GAN for Retrieving Representative Samples from a Trained Classifier.,4,https://aaai.org/ojs/index.php/AAAI/article/view/5709,https://dblp.org/rec/conf/aaai/AddepalliNCR20
1141,2020,Abhijin Adiga,nan,Anil Vullikanti,"Virginia Tech, Biocomplexity Institute, Blacksburg, VA, USA",AAAI,Bounds and Complexity Results for Learning Coalition-Based Interaction Functions in Networked Social Systems.,7,https://aaai.org/ojs/index.php/AAAI/article/view/5710,https://dblp.org/rec/conf/aaai/AdigaKMRRSV20
1142,2020,Leonard Adolphs,nan,Thomas Hofmann,"ETH Zurich, Switzerland",AAAI,LeDeepChef Deep Reinforcement Learning Agent for Families of Text-Based Games.,2,https://aaai.org/ojs/index.php/AAAI/article/view/6228,https://dblp.org/rec/conf/aaai/AdolphsH20
1143,2020,Aishwarya Agarwal,nan,Alexandros A. Voudouris,nan,AAAI,Swap Stability in Schelling Games on Graphs.,4,https://aaai.org/ojs/index.php/AAAI/article/view/5541,https://dblp.org/rec/conf/aaai/AgarwalEGV20
1144,2020,Mansi Agarwal,nan,Rajiv Ratn Shah,nan,AAAI,"Crisis-DIAS - Towards Multimodal Damage Analysis - Deployment, Challenges and Assessment.",4,https://aaai.org/ojs/index.php/AAAI/article/view/5369,https://dblp.org/rec/conf/aaai/AgarwalLSS20
