,year,first-author,first-author-affiliation,last-author,last-author-affiliation,journal/conference,title,number-of-authors,paper-url,DBLP-url
493,2012,Lukasz Kaiser,Łukasz Kaiser,Lukasz Kaiser,Łukasz Kaiser,AAAI,Learning Games from Videos Guided by Descriptive Complexity.,1,http://www.aaai.org/ocs/index.php/AAAI/AAAI12/paper/view/5091,https://dblp.org/rec/conf/aaai/Kaiser12
494,2012,Hiroshi Kajino,nan,Hisashi Kashima,nan,AAAI,A Convex Formulation for Learning from Crowds.,3,http://www.aaai.org/ocs/index.php/AAAI/AAAI12/paper/view/4919,https://dblp.org/rec/conf/aaai/KajinoTK12
495,2012,Hyohyeong Kang,nan,Seungjin Choi,nan,AAAI,Probabilistic Models for Common Spatial Patterns - Parameter-Expanded EM and Variational Bayes.,2,http://www.aaai.org/ocs/index.php/AAAI/AAAI12/paper/view/4839,https://dblp.org/rec/conf/aaai/KangC12
496,2012,Ashish Kapoor,nan,Eric Horvitz,Microsoft Research,AAAI,Learning to Learn - Algorithmic Inspirations from Human Problem Solving.,4,http://www.aaai.org/ocs/index.php/AAAI/AAAI12/paper/view/5175,https://dblp.org/rec/conf/aaai/KapoorLTH12
497,2012,Ashish Kapoor,nan,Eric Horvitz,Microsoft Research,AAAI,Performance and Preferences - Interactive Refinement of Machine Learning Procedures.,4,http://www.aaai.org/ocs/index.php/AAAI/AAAI12/paper/view/5131,https://dblp.org/rec/conf/aaai/KapoorLTH12a
498,2012,Sertac Karapinar,nan,Sanem Sariel Talay,"Istanbul Technical University, Turkey",AAAI,Failure Handling In a Planning Framework.,2,http://www.aaai.org/ocs/index.php/AAAI/AAAI12/paper/view/4885,https://dblp.org/rec/conf/aaai/KarapinarT12
499,2012,Michael Katz 0001,"IBM Thomas J. Watson Research Center, Yorktown Heights, NY, USA",Emil Keyder,nan,AAAI,Structural Patterns Beyond Forks - Extending the Complexity Boundaries of Classical Planning.,2,http://www.aaai.org/ocs/index.php/AAAI/AAAI12/paper/view/4795,https://dblp.org/rec/conf/aaai/KatzK12
500,2012,Kristian Kersting,"TU Darmstadt, Computer Science Department, Germany",Lutz Plümer,nan,AAAI,Pre-Symptomatic Prediction of Plant Drought Stress Using Dirichlet-Aggregation Regression on Hyperspectral Images.,10,http://www.aaai.org/ocs/index.php/AAAI/AAAI12/paper/view/4932,https://dblp.org/rec/conf/aaai/KerstingXWBTRBRLP12
501,2012,Philippe Van Kessel,nan,Claude-Guy Quimper,nan,AAAI,Filtering Algorithms Based on the Word-RAM Model.,2,http://www.aaai.org/ocs/index.php/AAAI/AAAI12/paper/view/5135,https://dblp.org/rec/conf/aaai/KesselQ12
502,2012,Emil Ragip Keyder,nan,Patrik Haslum,nan,AAAI,Semi-Relaxed Plan Heuristics.,3,http://www.aaai.org/ocs/index.php/AAAI/AAAI12/paper/view/4934,https://dblp.org/rec/conf/aaai/KeyderHH12
503,2012,Kyle Klein,nan,Subhash Suri,"University of California, Santa Barbara, Department of Computer Science",AAAI,Catch Me If You Can - Pursuit and Capture in Polygonal Environments with Obstacles.,2,http://www.aaai.org/ocs/index.php/AAAI/AAAI12/paper/view/4889,https://dblp.org/rec/conf/aaai/KleinS12
504,2012,Andrey Kolobov,nan,Daniel S. Weld,"University of Washington, Seattle, Washington, USA",AAAI,LRTDP Versus UCT for Online Probabilistic Planning.,3,http://www.aaai.org/ocs/index.php/AAAI/AAAI12/paper/view/4961,https://dblp.org/rec/conf/aaai/KolobovMW12
505,2012,Weihao Kong,nan,Wu-Jun Li,nan,AAAI,Double-Bit Quantization for Hashing.,2,http://www.aaai.org/ocs/index.php/AAAI/AAAI12/paper/view/5080,https://dblp.org/rec/conf/aaai/KongL12
506,2012,Richard E. Korf,nan,Richard E. Korf,nan,AAAI,Research Challenges in Combinatorial Search.,1,http://www.aaai.org/ocs/index.php/AAAI/AAAI12/paper/view/5094,https://dblp.org/rec/conf/aaai/Korf12
507,2012,Landon Kraemer,nan,Bikramjit Banerjee,nan,AAAI,Informed Initial Policies for Learning in Dec-POMDPs.,2,http://www.aaai.org/ocs/index.php/AAAI/AAAI12/paper/view/4860,https://dblp.org/rec/conf/aaai/KraemerB12
508,2012,Evan A. Krause,nan,Matthias Scheutz,nan,AAAI,Crossing Boundaries - Multi-Level Introspection in a Complex Robotic Architecture for Automatic Performance Improvements.,3,http://www.aaai.org/ocs/index.php/AAAI/AAAI12/paper/view/5011,https://dblp.org/rec/conf/aaai/KrauseSS12
509,2012,Akshat Kumar,nan,Shlomo Zilberstein,"University of Massachusetts Amherst, USA",AAAI,Lagrangian Relaxation Techniques for Scalable Spatial Conservation Planning.,3,http://www.aaai.org/ocs/index.php/AAAI/AAAI12/paper/view/4978,https://dblp.org/rec/conf/aaai/KumarWZ12
510,2012,Unmesh Kurup,nan,Martial Hebert,"Carnegie Mellon University, Pittsburgh, USA",AAAI,Using Expectations to Drive Cognitive Behavior.,4,http://www.aaai.org/ocs/index.php/AAAI/AAAI12/paper/view/5106,https://dblp.org/rec/conf/aaai/KurupLSH12
511,2012,Branislav Kveton,nan,Georgios Theocharous,nan,AAAI,Kernel-Based Reinforcement Learning on Representative States.,2,http://www.aaai.org/ocs/index.php/AAAI/AAAI12/paper/view/4967,https://dblp.org/rec/conf/aaai/KvetonT12
512,2012,Walter S. Lasecki,nan,George Ferguson,nan,AAAI,Real-Time Collaborative Planning with the Crowd.,4,http://www.aaai.org/ocs/index.php/AAAI/AAAI12/paper/view/4822,https://dblp.org/rec/conf/aaai/LaseckiBAF12
513,2012,Walter S. Lasecki,nan,Jeffrey P. Bigham,nan,AAAI,Online Sequence Alignment for Real-Time Audio Transcription by Non-Experts.,4,http://www.aaai.org/ocs/index.php/AAAI/AAAI12/paper/view/4823,https://dblp.org/rec/conf/aaai/LaseckiMBB12
514,2012,Ronan LeBras,Cornell University,Bart Selman,"Cornell University, Ithaca, USA",AAAI,From Streamlined Combinatorial Search to Efficient Constructive Procedures.,3,http://www.aaai.org/ocs/index.php/AAAI/AAAI12/paper/view/5170,https://dblp.org/rec/conf/aaai/LeBrasGS12
515,2012,Freddy Lécué,nan,Freddy Lécué,nan,AAAI,Diagnosing Changes in An Ontology Stream - A DL Reasoning Approach.,1,http://www.aaai.org/ocs/index.php/AAAI/AAAI12/paper/view/4988,https://dblp.org/rec/conf/aaai/Lecue12
516,2012,Jimmy Ho-Man Lee,nan,Yi Wu,nan,AAAI,Polynomially Decomposable Global Cost Functions in Weighted Constraint Satisfaction.,3,http://www.aaai.org/ocs/index.php/AAAI/AAAI12/paper/view/4943,https://dblp.org/rec/conf/aaai/LeeLW12
517,2012,Donghun Lee,nan,Warren B. Powell,"Princeton University, Department of Operations Research and Financial Engineering",AAAI,An Intelligent Battery Controller Using Bias-Corrected Q-learning.,2,http://www.aaai.org/ocs/index.php/AAAI/AAAI12/paper/view/4898,https://dblp.org/rec/conf/aaai/LeeP12
518,2012,Joohyung Lee 0002,"Arizona State University, Tempe, AZ, USA",Ravi Palla,nan,AAAI,Reformulating Temporal Action Logics in Answer Set Programming.,2,http://www.aaai.org/ocs/index.php/AAAI/AAAI12/paper/view/5121,https://dblp.org/rec/conf/aaai/LeeP12a
519,2012,Levi Lelis,nan,Robert C. Holte,"University of Alberta, Edmonton, Canada",AAAI,Fast and Accurate Predictions of IDA*'s Performance.,3,http://www.aaai.org/ocs/index.php/AAAI/AAAI12/paper/view/4962,https://dblp.org/rec/conf/aaai/LelisZH12
520,2012,Joshua Letchford,nan,Charles L. Isbell Jr.,"Georgia Institute of Technology, College of Computing, Atlanta, GA, USA",AAAI,Computing Optimal Strategies to Commit to in Stochastic Games.,5,http://www.aaai.org/ocs/index.php/AAAI/AAAI12/paper/view/5151,https://dblp.org/rec/conf/aaai/LetchfordMCPI12
521,2012,Tomer Levinboim,nan,Fei Sha,"University of Southern California, Los Angeles, USA",AAAI,Learning the Kernel Matrix with Low-Rank Multiplicative Shaping.,2,http://www.aaai.org/ocs/index.php/AAAI/AAAI12/paper/view/5035,https://dblp.org/rec/conf/aaai/LevinboimS12
522,2012,Omer Levy,nan,Shaul Markovitch,"Technion - Israel Institute of Technology, Haifa, Israel",AAAI,Teaching Machines to Learn by Metaphors.,2,http://www.aaai.org/ocs/index.php/AAAI/AAAI12/paper/view/4842,https://dblp.org/rec/conf/aaai/LevyM12
523,2012,Alberto Quattrini Li,nan,Nicola Basilico,nan,AAAI,Searching for Optimal Off-Line Exploration Paths in Grid Environments for a Robot with Limited Visibility.,3,http://www.aaai.org/ocs/index.php/AAAI/AAAI12/paper/view/5043,https://dblp.org/rec/conf/aaai/LiAB12
524,2012,Justin Li,nan,John E. Laird,"University of Michigan, Ann Arbor, USA",AAAI,Functional Interactions Between Memory and Recognition Judgments.,3,http://www.aaai.org/ocs/index.php/AAAI/AAAI12/paper/view/4851,https://dblp.org/rec/conf/aaai/LiDL12
525,2012,Jason Jingshi Li,nan,Jan Beutel,nan,AAAI,Sensing the Air We Breathe - The OpenSense Zurich Dataset.,5,http://www.aaai.org/ocs/index.php/AAAI/AAAI12/paper/view/4896,https://dblp.org/rec/conf/aaai/LiFSHB12
526,2012,Yun Li 0009,"Nanjing University of Posts and Telecommunications, Jiangsu Key Laboratory of Big Data Security and Intelligent Processing, Nanjing, China",Songcan Chen,nan,AAAI,Ensemble Feature Weighting Based on Local Learning and Diversity.,3,http://www.aaai.org/ocs/index.php/AAAI/AAAI12/paper/view/4818,https://dblp.org/rec/conf/aaai/LiGC12
527,2012,Yu-Feng Li,nan,Zhi-Hua Zhou,"Nanjing University, State Key Laboratory for Novel Software Technology, China",AAAI,Towards Discovering What Patterns Trigger What Labels.,4,http://www.aaai.org/ocs/index.php/AAAI/AAAI12/paper/view/4921,https://dblp.org/rec/conf/aaai/LiHJZ12
528,2012,Lianghao Li,nan,Mingsheng Long,nan,AAAI,Topic Correlation Analysis for Cross-Domain Text Classification.,3,http://www.aaai.org/ocs/index.php/AAAI/AAAI12/paper/view/5077,https://dblp.org/rec/conf/aaai/LiJL12
529,2012,Shoushan Li,nan,Guodong Zhou,nan,AAAI,Opinion Target Extraction Using a Shallow Semantic Parsing Framework.,3,http://www.aaai.org/ocs/index.php/AAAI/AAAI12/paper/view/4824,https://dblp.org/rec/conf/aaai/LiWZ12
530,2012,Bing Li 0001,李兵,Weiming Hu,nan,AAAI,Visual Saliency Map from Tensor Analysis.,3,http://www.aaai.org/ocs/index.php/AAAI/AAAI12/paper/view/4864,https://dblp.org/rec/conf/aaai/LiXH12
531,2012,Wu-Jun Li,nan,Dit-Yan Yeung,Hong Kong University of Science and Technology,AAAI,Sparse Probabilistic Relational Projection.,2,http://www.aaai.org/ocs/index.php/AAAI/AAAI12/paper/view/5044,https://dblp.org/rec/conf/aaai/LiY12
532,2012,Zechao Li,nan,Hanqing Lu,nan,AAAI,Unsupervised Feature Selection Using Nonnegative Spectral Analysis.,5,http://www.aaai.org/ocs/index.php/AAAI/AAAI12/paper/view/4955,https://dblp.org/rec/conf/aaai/LiYLZL12
533,2012,Guohua Liang,nan,Guohua Liang,nan,AAAI,An Investigation of Sensitivity on Bagging Predictors - An Empirical Approach.,1,http://www.aaai.org/ocs/index.php/AAAI/AAAI12/paper/view/4802,https://dblp.org/rec/conf/aaai/Liang12
534,2012,Yuliya Lierler,"University of Nebraska at Omaha, USA",Yuliya Lierler,"University of Nebraska at Omaha, USA",AAAI,On the Relation of Constraint Answer Set Programming Languages and Algorithms.,1,http://www.aaai.org/ocs/index.php/AAAI/AAAI12/paper/view/4850,https://dblp.org/rec/conf/aaai/Lierler12
535,2012,Yue Lin,nan,Xiaofei He 0001,"Zhejiang University, State Key Lab of CAD&CG, China",AAAI,Random Projection with Filtering for Nearly Duplicate Search.,4,http://www.aaai.org/ocs/index.php/AAAI/AAAI12/paper/view/4915,https://dblp.org/rec/conf/aaai/LinJCH12
536,2012,Christopher H. Lin,nan,Daniel S. Weld,"University of Washington, Seattle, Washington, USA",AAAI,Dynamically Switching between Synergistic Workflows for Crowdsourcing.,3,http://www.aaai.org/ocs/index.php/AAAI/AAAI12/paper/view/5129,https://dblp.org/rec/conf/aaai/LinMW12
537,2012,Xiao Ling,nan,Daniel S. Weld,"University of Washington, Seattle, Washington, USA",AAAI,Fine-Grained Entity Recognition.,2,http://www.aaai.org/ocs/index.php/AAAI/AAAI12/paper/view/5152,https://dblp.org/rec/conf/aaai/LingW12
538,2012,Xin Liu 0027,"Hangzhou Dianzi University, School of Automation, China",Anwitaman Datta,"Nanyang Technological University, Singapore",AAAI,Modeling Context Aware Dynamic Trust Using Hidden Markov Model.,2,http://www.aaai.org/ocs/index.php/AAAI/AAAI12/paper/view/4948,https://dblp.org/rec/conf/aaai/LiuD12
539,2012,Xiaohua Liu,nan,Ming Zhou 0001,"Microsoft Research Asia, Beijing, China",AAAI,Collective Nominal Semantic Role Labeling for Tweets.,4,http://www.aaai.org/ocs/index.php/AAAI/AAAI12/paper/view/4944,https://dblp.org/rec/conf/aaai/LiuFWZ12
540,2012,Kun-Lin Liu,nan,Minyi Guo,nan,AAAI,Emoticon Smoothed Language Models for Twitter Sentiment Analysis.,3,http://www.aaai.org/ocs/index.php/AAAI/AAAI12/paper/view/5083,https://dblp.org/rec/conf/aaai/LiuLG12
541,2012,Chang Liu 0021,"University of California, Berkeley, Department of EECS, CA, USA",Yong Yu 0001,俞勇,AAAI,Large Scale Temporal RDFS Reasoning Using MapReduce.,3,http://www.aaai.org/ocs/index.php/AAAI/AAAI12/paper/view/4815,https://dblp.org/rec/conf/aaai/LiuQY12
542,2012,Guanfeng Liu 0001,"Macquarie University, Department of Computing, Sydney, Australia",Mehmet A. Orgun,"Macquarie University, Sydney, Australia",AAAI,Social Context-Aware Trust Network Discovery in Complex Contextual Social Networks.,3,http://www.aaai.org/ocs/index.php/AAAI/AAAI12/paper/view/5037,https://dblp.org/rec/conf/aaai/LiuWO12
543,2012,Xiaohua Liu,nan,Ming Zhou 0001,"Microsoft Research Asia, Beijing, China",AAAI,Exacting Social Events for Tweets Using a Factor Graph.,5,http://www.aaai.org/ocs/index.php/AAAI/AAAI12/paper/view/4945,https://dblp.org/rec/conf/aaai/LiuZFWZ12
544,2012,Yan Liu 0004,"Hong Kong Polytechnic University, Department of Computing, Cognitive Computing Lab, Hong Kong",Wenjie Li 0002,"Hong Kong Polytechnic University, Department of Computing",AAAI,Query-Oriented Multi-Document Summarization via Unsupervised Deep Learning.,3,http://www.aaai.org/ocs/index.php/AAAI/AAAI12/paper/view/5058,https://dblp.org/rec/conf/aaai/LiuZL12
545,2012,Mingsheng Long,nan,Qiang Yang 0001,楊強,AAAI,Transfer Learning with Graph Co-Regularization.,5,http://www.aaai.org/ocs/index.php/AAAI/AAAI12/paper/view/4958,https://dblp.org/rec/conf/aaai/LongWDSY12
546,2012,Qiang Lou,nan,Zoran Obradovic,nan,AAAI,Margin-Based Feature Selection in Incomplete Data.,2,http://www.aaai.org/ocs/index.php/AAAI/AAAI12/paper/view/5000,https://dblp.org/rec/conf/aaai/LouO12
547,2012,Patrick Lucey,nan,Iain A. Matthews,"Disney Research Pittsburgh, USA",AAAI,Characterizing Multi-Agent Team Behavior from Partial Team Tracings - Evidence from the English Premier League.,5,http://www.aaai.org/ocs/index.php/AAAI/AAAI12/paper/view/5004,https://dblp.org/rec/conf/aaai/LuceyBCFM12
548,2012,Zhunchen Luo,nan,Ting Wang,nan,AAAI,Improving Twitter Retrieval by Exploiting Structural Information.,4,http://www.aaai.org/ocs/index.php/AAAI/AAAI12/paper/view/4913,https://dblp.org/rec/conf/aaai/LuoOPW12
549,2012,Patrick MacAlpine,nan,Peter Stone,"University of Texas at Austin, USA",AAAI,Design and Optimization of an Omnidirectional Humanoid Walk - A Winning Approach at the RoboCup 2011 3D Simulation Competition.,5,http://www.aaai.org/ocs/index.php/AAAI/AAAI12/paper/view/5111,https://dblp.org/rec/conf/aaai/MacAlpineBUVS12
550,2012,Abdul Majid,nan,Gencai Chen,nan,AAAI,Mining Context-Aware Significant Travel Sequences from Geotagged Social Media.,5,http://www.aaai.org/ocs/index.php/AAAI/AAAI12/paper/view/4742,https://dblp.org/rec/conf/aaai/MajidCMHC12
551,2012,Juan Fernando Mancilla-Caceres,nan,Dorothy Espelage,nan,AAAI,Identifying Bullies with a Computer Game.,4,http://www.aaai.org/ocs/index.php/AAAI/AAAI12/paper/view/5140,https://dblp.org/rec/conf/aaai/Mancilla-CaceresPAE12
552,2012,Neo D. Martinez,nan,Jennifer A. Dunne,nan,AAAI,Sustaining Economic Exploitation of Complex Ecosystems in Computational Models of Coupled Human-Natural Networks.,8,http://www.aaai.org/ocs/index.php/AAAI/AAAI12/paper/view/5123,https://dblp.org/rec/conf/aaai/MartinezTBRSYYD12
553,2012,Laëtitia Matignon,nan,Abdel-Illah Mouaddib,nan,AAAI,Coordinated Multi-Robot Exploration Under Communication Constraints Using Decentralized Markov Decision Processes.,3,http://www.aaai.org/ocs/index.php/AAAI/AAAI12/paper/view/5038,https://dblp.org/rec/conf/aaai/MatignonJM12
554,2012,Tim Matthews,nan,Georgios Chalkiadakis,nan,AAAI,Competing with Humans at Fantasy Football - Team Formation in Large Partially-Observable Domains.,3,http://www.aaai.org/ocs/index.php/AAAI/AAAI12/paper/view/5088,https://dblp.org/rec/conf/aaai/MatthewsRC12
555,2012,Scott McQuade,nan,Claire Monteleoni,"University of Colorado Boulder, CO, USA",AAAI,Global Climate Model Tracking Using Geospatial Neighborhoods.,2,http://www.aaai.org/ocs/index.php/AAAI/AAAI12/paper/view/5158,https://dblp.org/rec/conf/aaai/McQuadeM12
556,2012,Reshef Meir,nan,Peter B. Key,nan,AAAI,Congestion Games with Agent Failures.,4,http://www.aaai.org/ocs/index.php/AAAI/AAAI12/paper/view/4987,https://dblp.org/rec/conf/aaai/MeirTBK12
557,2012,Amit Metodi,nan,Michael Codish,"Ben-Gurion University, Beersheba, Israel",AAAI,Compiling Model-Based Diagnosis to Boolean Satisfaction.,4,http://www.aaai.org/ocs/index.php/AAAI/AAAI12/paper/view/4985,https://dblp.org/rec/conf/aaai/MetodiSKC12
558,2012,Daniel Meyer-Delius,nan,Wolfram Burgard,"University of Freiburg, Germany",AAAI,Occupancy Grid Models for Robot Mapping in Changing Environments.,3,http://www.aaai.org/ocs/index.php/AAAI/AAAI12/paper/view/4983,https://dblp.org/rec/conf/aaai/Meyer-DeliusBB12
559,2012,Shiwali Mohan,nan,Shiwali Mohan,nan,AAAI,Learning Actions and Action Verbs from Human-Agent Interaction.,1,http://www.aaai.org/ocs/index.php/AAAI/AAAI12/paper/view/4856,https://dblp.org/rec/conf/aaai/Mohan12
560,2012,Shiwali Mohan,nan,John E. Laird,"University of Michigan, Ann Arbor, USA",AAAI,Exploring Mixed-Initiative Interaction for Learning with Situated Instruction in Cognitive Agents.,2,http://www.aaai.org/ocs/index.php/AAAI/AAAI12/paper/view/4834,https://dblp.org/rec/conf/aaai/MohanL12
561,2012,Mitra Mohtarami,nan,Chew Lim Tan,"National University of Singapore (NUS), School of Computing, Singapore",AAAI,Sense Sentiment Similarity - An Analysis.,5,http://www.aaai.org/ocs/index.php/AAAI/AAAI12/paper/view/5172,https://dblp.org/rec/conf/aaai/MohtaramiALTT12
562,2012,Mohamed Morsey,nan,Axel-Cyrille Ngonga Ngomo,"Paderborn University, Germany",AAAI,Usage-Centric Benchmarking of RDF Triple Stores.,4,http://www.aaai.org/ocs/index.php/AAAI/AAAI12/paper/view/5168,https://dblp.org/rec/conf/aaai/MorseyLAN12
563,2012,Daniel Morwood,nan,Daniel Bryce,nan,AAAI,Evaluating Temporal Plans in Incomplete Domains.,2,http://www.aaai.org/ocs/index.php/AAAI/AAAI12/paper/view/4875,https://dblp.org/rec/conf/aaai/MorwoodB12
564,2012,Lilia Moshkina,nan,Lilia Moshkina,nan,AAAI,Improving Request Compliance through Robot Affect.,1,http://www.aaai.org/ocs/index.php/AAAI/AAAI12/paper/view/5085,https://dblp.org/rec/conf/aaai/Moshkina12
565,2012,Martin Gordon Mubangizi,nan,John A. Quinn,nan,AAAI,Coupling Spatiotemporal Disease Modeling with Diagnosis.,4,http://www.aaai.org/ocs/index.php/AAAI/AAAI12/paper/view/5179,https://dblp.org/rec/conf/aaai/MubangiziISQ12
566,2012,Christian J. Muise,nan,Christian J. Muise,nan,AAAI,Generalizing and Executing Plans.,1,http://www.aaai.org/ocs/index.php/AAAI/AAAI12/paper/view/4886,https://dblp.org/rec/conf/aaai/Muise12
567,2012,Naveen Nair,nan,Shonali Krishnaswamy,"Monash University, Melbourne, Australia",AAAI,Rule Ensemble Learning Using Hierarchical Kernels in Structured Output Spaces.,4,http://www.aaai.org/ocs/index.php/AAAI/AAAI12/paper/view/4918,https://dblp.org/rec/conf/aaai/NairSRK12
568,2012,Swaprava Nath,nan,James Y. Zou,"Stanford University, Department of Electrical Engineering, CA, USA",AAAI,Threats and Trade-Offs in Resource Critical Crowdsourcing Tasks Over Networks.,5,http://www.aaai.org/ocs/index.php/AAAI/AAAI12/paper/view/4807,https://dblp.org/rec/conf/aaai/NathDGNZ12
569,2012,Aniruddh Nath,nan,Matthew Richardson,nan,AAAI,Counting-MLNs - Learning Relational Structure for Decision Making.,2,http://www.aaai.org/ocs/index.php/AAAI/AAAI12/paper/view/5134,https://dblp.org/rec/conf/aaai/NathR12
570,2012,Roberto Navigli,"Sapienza University of Rome, Italy",Simone Paolo Ponzetto,"University of Mannheim, Department of Computer Science, Germany",AAAI,BabelRelate! A Joint Multilingual Approach to Computing Semantic Relatedness.,2,http://www.aaai.org/ocs/index.php/AAAI/AAAI12/paper/view/5112,https://dblp.org/rec/conf/aaai/NavigliP12
571,2012,Sushobhan Nayak,nan,Amitabha Mukerjee,"Indian Institute of Technology Kanpur, India",AAAI,A Grounded Cognitive Model for Metaphor Acquisition.,2,http://www.aaai.org/ocs/index.php/AAAI/AAAI12/paper/view/5010,https://dblp.org/rec/conf/aaai/NayakM12
572,2012,Brenda Ng,nan,Andrew Wang,nan,AAAI,Bayes-Adaptive Interactive POMDPs.,4,http://www.aaai.org/ocs/index.php/AAAI/AAAI12/paper/view/5120,https://dblp.org/rec/conf/aaai/NgBMW12
573,2012,Phuong Minh Nguyen,nan,Marcus Hutter,"Australian National University, Canberra, Australia",AAAI,Context Tree Maximizing.,3,http://www.aaai.org/ocs/index.php/AAAI/AAAI12/paper/view/5079,https://dblp.org/rec/conf/aaai/NguyenSH12
574,2012,Feiping Nie 0001,"Northwestern Polytechnical University, School of Computer Science, OPTIMAL, Xi'an, China",Chris H. Q. Ding,"University of Texas at Arlington, Department of Computer Science and Engineering",AAAI,Low-Rank Matrix Recovery via Efficient Schatten p-Norm Minimization.,3,http://www.aaai.org/ocs/index.php/AAAI/AAAI12/paper/view/5165,https://dblp.org/rec/conf/aaai/NieHD12
575,2012,Scott Niekum,nan,Scott Niekum,nan,AAAI,Complex Task Learning from Unstructured Demonstrations.,1,http://www.aaai.org/ocs/index.php/AAAI/AAAI12/paper/view/4766,https://dblp.org/rec/conf/aaai/Niekum12
576,2012,Oliver Niggemann,"Hochschule Ostwestfalen-Lippe, Lemgo, Germany",Hans Kleine Büning,"University of Paderborn, Germany",AAAI,Learning Behavior Models for Hybrid Timed Systems.,5,http://www.aaai.org/ocs/index.php/AAAI/AAAI12/paper/view/4993,https://dblp.org/rec/conf/aaai/NiggemannSVMB12
577,2012,Nozomi Nori,nan,Hisashi Kashima,nan,AAAI,Multinomial Relation Prediction in Social Data - A Dimension Reduction Approach.,3,http://www.aaai.org/ocs/index.php/AAAI/AAAI12/paper/view/4971,https://dblp.org/rec/conf/aaai/NoriBK12
578,2012,Barry O'Sullivan,"University College Cork, Ireland",Barry O'Sullivan,"University College Cork, Ireland",AAAI,Opportunities and Challenges for Constraint Programming.,1,http://www.aaai.org/ocs/index.php/AAAI/AAAI12/paper/view/5189,https://dblp.org/rec/conf/aaai/OSullivan12
579,2012,Svetlana Obraztsova,nan,Edith Elkind,"University of Oxford, UK",AAAI,Optimal Manipulation of Voting Rules.,2,http://www.aaai.org/ocs/index.php/AAAI/AAAI12/paper/view/5059,https://dblp.org/rec/conf/aaai/ObraztsovaE12
580,2012,Frans Adriaan Oliehoek,nan,Matthijs T. J. Spaan,"Delft University of Technology, Netherlands",AAAI,Tree-Based Solution Methods for Multiagent POMDPs with Delayed Communication.,2,http://www.aaai.org/ocs/index.php/AAAI/AAAI12/paper/view/5066,https://dblp.org/rec/conf/aaai/OliehoekS12
581,2012,Frans Adriaan Oliehoek,nan,Leslie Pack Kaelbling,"MIT Computer Science and Artificial Intelligence Laboratory, Cambridge, USA",AAAI,Influence-Based Abstraction for Multiagent Systems.,3,http://www.aaai.org/ocs/index.php/AAAI/AAAI12/paper/view/5047,https://dblp.org/rec/conf/aaai/OliehoekWK12
582,2012,Michael A. Osborne,nan,Nando de Freitas,"Google DeepMind, London, UK",AAAI,Prediction and Fault Detection of Environmental Signals with Uncharacterised Faults.,4,http://www.aaai.org/ocs/index.php/AAAI/AAAI12/paper/view/5055,https://dblp.org/rec/conf/aaai/OsborneGSF12
583,2012,Takayuki Osogami,nan,Tetsuro Morimura,nan,AAAI,Time-Consistency of Optimization Problems.,2,http://www.aaai.org/ocs/index.php/AAAI/AAAI12/paper/view/4846,https://dblp.org/rec/conf/aaai/OsogamiM12
584,2012,Takuma Otsuka,nan,Hiroshi G. Okuno,nan,AAAI,Bayesian Unification of Sound Source Localization and Separation with Permutation Resolution.,4,http://www.aaai.org/ocs/index.php/AAAI/AAAI12/paper/view/4911,https://dblp.org/rec/conf/aaai/OtsukaISO12
585,2012,Brammert Ottens,nan,Boi Faltings,"Swiss Federal Institute of Technology in Lausanne, Switzerland",AAAI,DUCT - An Upper Confidence Bound Approach to Distributed Constraint Optimization Problems.,3,http://www.aaai.org/ocs/index.php/AAAI/AAAI12/paper/view/4938,https://dblp.org/rec/conf/aaai/OttensDF12
586,2012,Diane Oyen,nan,Terran Lane,nan,AAAI,Leveraging Domain Knowledge in Multitask Bayesian Network Structure Learning.,2,http://www.aaai.org/ocs/index.php/AAAI/AAAI12/paper/view/5013,https://dblp.org/rec/conf/aaai/OyenL12
587,2012,Deniz Ozsoyeller,nan,Andrew Beveridge,nan,AAAI,Symmetric Rendezvous in Planar Environments With and Without Obstacles.,3,http://www.aaai.org/ocs/index.php/AAAI/AAAI12/paper/view/5086,https://dblp.org/rec/conf/aaai/OzsoyellerIB12
588,2012,David Page,"University of Wisconsin-Madison, Madison, USA",Michael Caldwell,nan,AAAI,Identifying Adverse Drug Events by Relational Learning.,6,http://www.aaai.org/ocs/index.php/AAAI/AAAI12/paper/view/4941,https://dblp.org/rec/conf/aaai/PageCNBPC12
589,2012,Weike Pan,Hong Kong University of Science and Technology,Qiang Yang 0001,楊強,AAAI,Transfer Learning in Collaborative Filtering with Uncertain Ratings.,3,http://www.aaai.org/ocs/index.php/AAAI/AAAI12/paper/view/4826,https://dblp.org/rec/conf/aaai/PanXY12
590,2012,Gaurav Pandey 0004,"Ford Motor Company, Palo Alto, USA",Ryan M. Eustice,"University of Michigan, Department of Naval Architecture & Marine Engineering",AAAI,Automatic Targetless Extrinsic Calibration of a 3D Lidar and Camera by Maximizing Mutual Information.,4,http://www.aaai.org/ocs/index.php/AAAI/AAAI12/paper/view/5029,https://dblp.org/rec/conf/aaai/PandeyMSE12
591,2012,Anastasia Paparrizou,nan,Kostas Stergiou 0001,"University of Western Macedonia, Greece",AAAI,An Efficient Higher-Order Consistency Algorithm for Table Constraints.,2,http://www.aaai.org/ocs/index.php/AAAI/AAAI12/paper/view/4973,https://dblp.org/rec/conf/aaai/PaparrizouS12
592,2012,Devi Parikh,nan,Kristen Grauman,"University of Texas at Austin, USA",AAAI,Relative Attributes for Enhanced Human-Machine Communication.,4,http://www.aaai.org/ocs/index.php/AAAI/AAAI12/paper/view/5084,https://dblp.org/rec/conf/aaai/ParikhKPG12
