,year,first-author,first-author-affiliation,last-author,last-author-affiliation,journal/conference,title,number-of-authors,paper-url,DBLP-url
513,2021,Jinhua Du,nan,Karo Moilanen,nan,AAAI,Knowledge-aware Leap-LSTM - Integrating Prior Knowledge into Leap-LSTM towards Faster Long Text Classification.,3,https://ojs.aaai.org/index.php/AAAI/article/view/17511,https://dblp.org/rec/conf/aaai/DuHM21
514,2021,Xuefeng Du,nan,Zhenguo Li,nan,AAAI,How to Save your Annotation Cost for Panoptic Segmentation?,5,https://ojs.aaai.org/index.php/AAAI/article/view/16216,https://dblp.org/rec/conf/aaai/DuJXZL21
515,2021,Yihan Du,nan,Wei Chen 0034,陈薇,AAAI,Combinatorial Pure Exploration with Full-Bandit or Partial Linear Feedback.,3,https://ojs.aaai.org/index.php/AAAI/article/view/16892,https://dblp.org/rec/conf/aaai/DuK021
516,2021,Yihan Du,nan,Longbo Huang,nan,AAAI,A One-Size-Fits-All Solution to Conservative Bandit Problems.,3,https://ojs.aaai.org/index.php/AAAI/article/view/16891,https://dblp.org/rec/conf/aaai/DuWH21
517,2021,Sebastijan Dumancic,nan,Andrew Cropper,nan,AAAI,Knowledge Refactoring for Inductive Program Synthesis.,3,https://ojs.aaai.org/index.php/AAAI/article/view/16893,https://dblp.org/rec/conf/aaai/DumancicGC21
518,2021,Sebastijan Dumancic,nan,Koen Denies,nan,AAAI,Automated Reasoning and Learning for Automated Payroll Management.,6,https://ojs.aaai.org/index.php/AAAI/article/view/17774,https://dblp.org/rec/conf/aaai/DumancicMGSHD21
519,2021,Yaqian Dun,nan,Xiaojie Yuan,nan,AAAI,KAN - Knowledge-aware Attention Network for Fake News Detection.,5,https://ojs.aaai.org/index.php/AAAI/article/view/16080,https://dblp.org/rec/conf/aaai/DunTCHY21
520,2021,Chinmoy Dutta,nan,Chinmoy Dutta,nan,AAAI,When Hashing Met Matching - Efficient Spatio-Temporal Search for Ridesharing.,1,https://ojs.aaai.org/index.php/AAAI/article/view/16081,https://dblp.org/rec/conf/aaai/Dutta21
521,2021,Ujjal Kr Dutta,nan,Chellu Chandra Shekhar,nan,AAAI,Semi-Supervised Metric Learning - A Deep Resurrection.,3,https://ojs.aaai.org/index.php/AAAI/article/view/16894,https://dblp.org/rec/conf/aaai/DuttaHS21
522,2021,Wolfgang Dvorák,"University of Vienna, Austria",Stefan Woltran,"TU Wien, Vienna, Autria",AAAI,Recursion in Abstract Argumentation is Hard - On the Complexity of Semantics Based on Weak Admissibility.,3,https://ojs.aaai.org/index.php/AAAI/article/view/16781,https://dblp.org/rec/conf/aaai/Dvorak0W21
523,2021,Wolfgang Dvorák,"University of Vienna, Austria",Stefan Woltran,"TU Wien, Vienna, Autria",AAAI,The Complexity Landscape of Claim-Augmented Argumentation Frameworks.,4,https://ojs.aaai.org/index.php/AAAI/article/view/16782,https://dblp.org/rec/conf/aaai/DvorakGRW21
524,2021,Alon Eden,nan,Ori Zviran,nan,AAAI,PoA of Simple Auctions with Interdependent Values.,4,https://ojs.aaai.org/index.php/AAAI/article/view/16671,https://dblp.org/rec/conf/aaai/EdenFTZ21
525,2021,Yonathan Efroni,nan,Shie Mannor,nan,AAAI,Reinforcement Learning with Trajectory Feedback.,3,https://ojs.aaai.org/index.php/AAAI/article/view/16895,https://dblp.org/rec/conf/aaai/EfroniMM21
526,2021,Eduard Eiben,nan,Stefan Szeider,"TU Wien, Vienna, Austria",AAAI,The Parameterized Complexity of Clustering Incomplete Data.,5,https://ojs.aaai.org/index.php/AAAI/article/view/16896,https://dblp.org/rec/conf/aaai/EibenGKOS21
527,2021,Matthew Eicholtz,nan,Christian Roberson,nan,AAAI,Heisenbot - A Rule-Based Game Agent for Gin Rummy.,4,https://ojs.aaai.org/index.php/AAAI/article/view/17823,https://dblp.org/rec/conf/aaai/EicholtzMTR21
528,2021,Thomas Eiter,"TU Wien, Vienna, Austria",Rafael Kiesel,nan,AAAI,On the Complexity of Sum-of-Products Problems over Semirings.,2,https://ojs.aaai.org/index.php/AAAI/article/view/16783,https://dblp.org/rec/conf/aaai/EiterK21
529,2021,Benjamin Elder,nan,Jirí Navrátil 0001,"Thomas J. Watson Research Center, Yorktown Heights, NY USA",AAAI,Learning Prediction Intervals for Model Performance.,4,https://ojs.aaai.org/index.php/AAAI/article/view/16897,https://dblp.org/rec/conf/aaai/ElderAM021
530,2021,Edith Elkind,"University of Oxford, UK",Nimrod Talmon,nan,AAAI,United for Change - Deliberative Coalition Formation to Change the Status Quo.,4,https://ojs.aaai.org/index.php/AAAI/article/view/16673,https://dblp.org/rec/conf/aaai/ElkindGST21
531,2021,Edith Elkind,"University of Oxford, UK",Warut Suksompong,nan,AAAI,Mind the Gap - Cake Cutting With Separation.,3,https://ojs.aaai.org/index.php/AAAI/article/view/16672,https://dblp.org/rec/conf/aaai/ElkindSS21
532,2021,Alina Ene,nan,Adrian Vladu,nan,AAAI,Adaptive Gradient Methods for Constrained Convex Optimization and Variational Inequalities.,3,https://ojs.aaai.org/index.php/AAAI/article/view/16898,https://dblp.org/rec/conf/aaai/EneNV21
533,2021,Alina Ene,nan,Adrian Vladu,nan,AAAI,Projection-Free Bandit Optimization with Privacy Guarantees.,3,https://ojs.aaai.org/index.php/AAAI/article/view/16899,https://dblp.org/rec/conf/aaai/EneNV21a
534,2021,Shohei Enomoto,nan,Takeharu Eda,nan,AAAI,Learning to Cascade - Confidence Calibration for Improving the Accuracy and Computational Cost of Cascade Inference Systems.,2,https://ojs.aaai.org/index.php/AAAI/article/view/16900,https://dblp.org/rec/conf/aaai/EnomotoE21
535,2021,Sophia Epstein,nan,Pavel Naumov,nan,AAAI,Epistemic Logic of Know-Who.,2,https://ojs.aaai.org/index.php/AAAI/article/view/17367,https://dblp.org/rec/conf/aaai/EpsteinN21
536,2021,Hossein Esfandiari,"University of Maryland, College Park, USA",Vahab S. Mirrokni,"Google Research, New York City, USA",AAAI,Regret Bounds for Batched Bandits.,4,https://ojs.aaai.org/index.php/AAAI/article/view/16901,https://dblp.org/rec/conf/aaai/EsfandiariKMM21
537,2021,Hossein Esfandiari,"University of Maryland, College Park, USA",Peilin Zhong,nan,AAAI,Almost Linear Time Density Level Set Estimation via DBSCAN.,3,https://ojs.aaai.org/index.php/AAAI/article/view/16902,https://dblp.org/rec/conf/aaai/EsfandiariMZ21
538,2021,Andrew Estornell,nan,Yevgeniy Vorobeychik,nan,AAAI,Incentivizing Truthfulness Through Audits in Strategic Classification.,3,https://ojs.aaai.org/index.php/AAAI/article/view/16674,https://dblp.org/rec/conf/aaai/EstornellDV21
539,2021,Negar Etemadyrad,nan,Liang Zhao 0002,"George Mason University, Department of Information Science and Technology, Fairfax, VA, USA",AAAI,Deep Graph Spectral Evolution Networks for Graph Topological Evolution.,3,https://ojs.aaai.org/index.php/AAAI/article/view/16903,https://dblp.org/rec/conf/aaai/EtemadyradL021
540,2021,Tom Everitt,Australian National University,Shane Legg,nan,AAAI,Agent Incentives - A Causal Perspective.,5,https://ojs.aaai.org/index.php/AAAI/article/view/17368,https://dblp.org/rec/conf/aaai/EverittCLOL21
541,2021,Kshitij P. Fadnis,nan,Luis A. Lastras,"IBM Thomas J. Watson Research Center, Yorktown Heights, NY, USA",AAAI,Doc2Bot - Document grounded Bot Framework.,8,https://ojs.aaai.org/index.php/AAAI/article/view/18001,https://dblp.org/rec/conf/aaai/FadnisDZLRMJL21
542,2021,Xiaomeng Fan,nan,Mehrtash Harandi,"Monash University, Clayton, VIC, Australia",AAAI,Learning a Gradient-free Riemannian Optimizer on Tangent Spaces.,5,https://ojs.aaai.org/index.php/AAAI/article/view/16905,https://dblp.org/rec/conf/aaai/FanGWJH21
543,2021,Jiameng Fan,nan,Wenchao Li,nan,AAAI,Adversarial Training and Provable Robustness - A Tale of Two Objectives.,2,https://ojs.aaai.org/index.php/AAAI/article/view/16904,https://dblp.org/rec/conf/aaai/FanL21
544,2021,Yue Fan,nan,Xiuli Ma,nan,AAAI,Gene Regulatory Network Inference using 3D Convolutional Neural Network.,2,https://ojs.aaai.org/index.php/AAAI/article/view/16082,https://dblp.org/rec/conf/aaai/FanM21
545,2021,Yang Fan,nan,Xiang-Yang Li 0001,李向阳,AAAI,Learning to Reweight with Deep Interactions.,8,https://ojs.aaai.org/index.php/AAAI/article/view/16906,https://dblp.org/rec/conf/aaai/FanXW0L0Q021
546,2021,Jorge Fandinno,nan,Markus Hecher,nan,AAAI,Treewidth-Aware Complexity in ASP - Not all Positive Cycles are Equally Hard.,2,https://ojs.aaai.org/index.php/AAAI/article/view/16784,https://dblp.org/rec/conf/aaai/FandinnoH21
547,2021,Yuchen Fang,nan,Tie-Yan Liu,Microsoft Research,AAAI,Universal Trading for Order Execution with Oracle Policy Distillation.,8,https://ojs.aaai.org/index.php/AAAI/article/view/16083,https://dblp.org/rec/conf/aaai/FangRLZ00YL21
548,2021,Yuwei Fang,nan,Jingjing Liu,nan,AAAI,FILTER - An Enhanced Fusion Method for Cross-lingual Language Understanding.,5,https://ojs.aaai.org/index.php/AAAI/article/view/17512,https://dblp.org/rec/conf/aaai/FangWGSL21
549,2021,Haoshu Fang,nan,Cewu Lu,"Shanghai Jiao Tong University, Department of Computer Science and Engineering, China",AAAI,DIRV - Dense Interaction Region Voting for End-to-End Human-Object Interaction Detection.,4,https://ojs.aaai.org/index.php/AAAI/article/view/16217,https://dblp.org/rec/conf/aaai/FangXSL21
550,2021,Haoshu Fang,nan,Cewu Lu,"Shanghai Jiao Tong University, Department of Computer Science and Engineering, China",AAAI,DecAug - Augmenting HOI Detection via Decomposition.,5,https://ojs.aaai.org/index.php/AAAI/article/view/16218,https://dblp.org/rec/conf/aaai/FangXSLL21
551,2021,Gabriele Farina,nan,Tuomas Sandholm,"Carnegie Mellon University, Pittsburgh, USA",AAAI,Faster Game Solving via Predictive Blackwell Approachability - Connecting Regret Matching and Mirror Descent.,3,https://ojs.aaai.org/index.php/AAAI/article/view/16676,https://dblp.org/rec/conf/aaai/FarinaKS21
552,2021,Gabriele Farina,nan,Tuomas Sandholm,"Carnegie Mellon University, Pittsburgh, USA",AAAI,Model-Free Online Learning in Unknown Sequential Decision Making Problems and Games.,2,https://ojs.aaai.org/index.php/AAAI/article/view/16678,https://dblp.org/rec/conf/aaai/FarinaS21
553,2021,Gabriele Farina,nan,Tuomas Sandholm,"Carnegie Mellon University, Pittsburgh, USA",AAAI,Bandit Linear Optimization for Sequential Decision Making and Extensive-Form Games.,3,https://ojs.aaai.org/index.php/AAAI/article/view/16677,https://dblp.org/rec/conf/aaai/FarinaSS21
554,2021,Golnoosh Farnadi,nan,Margarida Carvalho,nan,AAAI,Individual Fairness in Kidney Exchange Programs.,4,https://ojs.aaai.org/index.php/AAAI/article/view/17369,https://dblp.org/rec/conf/aaai/FarnadiSBC21
555,2021,Amirreza Farnoosh,nan,Sarah Ostadabbas,nan,AAAI,Deep Switching Auto-Regressive Factorization - Application to Time Series Forecasting.,3,https://ojs.aaai.org/index.php/AAAI/article/view/16907,https://dblp.org/rec/conf/aaai/FarnooshAO21
556,2021,Nicolas R. Fauceglia,"IBM T.J. Watson Research Center, Yorktown Heights, NY, USA",Avirup Sil,nan,AAAI,KAAPA - Knowledge Aware Answers from PDF Analysis.,15,https://ojs.aaai.org/index.php/AAAI/article/view/18002,https://dblp.org/rec/conf/aaai/FaucegliaCGLWBM21
557,2021,Mark Feblowitz,nan,Octavian Udrea,nan,AAAI,IBM Scenario Planning Advisor - A Neuro-Symbolic ERM Solution.,6,https://ojs.aaai.org/index.php/AAAI/article/view/18003,https://dblp.org/rec/conf/aaai/FeblowitzH0SSU21
558,2021,Zhengcong Fei,nan,Zhengcong Fei,nan,AAAI,Partially Non-Autoregressive Image Captioning.,1,https://ojs.aaai.org/index.php/AAAI/article/view/16219,https://dblp.org/rec/conf/aaai/Fei21
559,2021,Zhengcong Fei,nan,Zhengcong Fei,nan,AAAI,Memory-Augmented Image Captioning.,1,https://ojs.aaai.org/index.php/AAAI/article/view/16220,https://dblp.org/rec/conf/aaai/Fei21a
560,2021,Zhengcong Fei,nan,Zhengcong Fei,nan,AAAI,Retrieve and Revise - Improving Peptide Identification with Similar Mass Spectra.,1,https://ojs.aaai.org/index.php/AAAI/article/view/17734,https://dblp.org/rec/conf/aaai/Fei21b
561,2021,Michal Feldman,nan,Galia Shabtai,nan,AAAI,Simultaneous 2nd Price Item Auctions with No-Underbidding.,2,https://ojs.aaai.org/index.php/AAAI/article/view/16679,https://dblp.org/rec/conf/aaai/FeldmanS21
562,2021,Paolo Felli,"Free University of Bozen-Bolzano, Italy",Marco Montali,nan,AAAI,SMT-based Safety Checking of Parameterized Multi-Agent Systems.,3,https://ojs.aaai.org/index.php/AAAI/article/view/16785,https://dblp.org/rec/conf/aaai/FelliGM21
563,2021,Chao Feng,nan,Chao Qian 0001,钱 超,AAAI,Multi-Objective Submodular Maximization by Regret Ratio Minimization with Theoretical Guarantee.,2,https://ojs.aaai.org/index.php/AAAI/article/view/17460,https://dblp.org/rec/conf/aaai/Feng021
564,2021,Shaoxiong Feng,nan,Xu Sun 0001,"Peking University, School of EECS, MOE Key Lab of Computational Linguistics, China",AAAI,Collaborative Group Learning.,6,https://ojs.aaai.org/index.php/AAAI/article/view/16911,https://dblp.org/rec/conf/aaai/FengCRD0021
565,2021,Zunlei Feng,nan,Mingli Song,nan,AAAI,Visual Boundary Knowledge Translation for Foreground Segmentation.,7,https://ojs.aaai.org/index.php/AAAI/article/view/16222,https://dblp.org/rec/conf/aaai/FengCWWLDS21
566,2021,Haozhe Feng,nan,Wei Chen,nan,AAAI,SHOT-VAE - Semi-supervised Deep Generative Models With Label-aware ELBO Approximations.,6,https://ojs.aaai.org/index.php/AAAI/article/view/16909,https://dblp.org/rec/conf/aaai/FengKCZZC21
567,2021,Lingyun Feng,nan,Ying Shen,nan,AAAI,Learning to Augment for Data-scarce Domain BERT Knowledge Distillation.,5,https://ojs.aaai.org/index.php/AAAI/article/view/16910,https://dblp.org/rec/conf/aaai/FengQLZS21
568,2021,Shaoxiong Feng,nan,Xu Sun 0001,"Peking University, School of EECS, MOE Key Lab of Computational Linguistics, China",AAAI,Multi-View Feature Representation for Dialogue Generation with Bidirectional Distillation.,4,https://ojs.aaai.org/index.php/AAAI/article/view/17516,https://dblp.org/rec/conf/aaai/FengRL021
569,2021,Boyuan Feng,nan,Yufei Ding,nan,AAAI,UAG - Uncertainty-aware Attention Graph Neural Network for Defending Adversarial Attacks.,3,https://ojs.aaai.org/index.php/AAAI/article/view/16908,https://dblp.org/rec/conf/aaai/FengWD21
570,2021,Zunlei Feng,nan,Mingli Song,nan,AAAI,Edge-competing Pathological Liver Vessel Segmentation with Limited Labels.,8,https://ojs.aaai.org/index.php/AAAI/article/view/16221,https://dblp.org/rec/conf/aaai/FengWWZCLWS21
571,2021,Chun-Mei Feng,nan,Ling Shao 0001,"Inception Institute of Artificial Intelligence (IIAI), Abu Dhabi, UAE",AAAI,Dual-Octave Convolution for Accelerated Parallel MR Image Reconstruction.,5,https://ojs.aaai.org/index.php/AAAI/article/view/16084,https://dblp.org/rec/conf/aaai/FengYCX021
572,2021,Jonathan Ferrer-Mestres,nan,Iadine Chades,nan,AAAI,K-N-MOMDPs - Towards Interpretable Solutions for Adaptive Management.,4,https://ojs.aaai.org/index.php/AAAI/article/view/17735,https://dblp.org/rec/conf/aaai/Ferrer-MestresD21
573,2021,Johannes Klaus Fichte,nan,Arne Meier,"Leibniz Universität Hannover, Germany",AAAI,Knowledge-Base Degrees of Inconsistency - Complexity and Counting.,3,https://ojs.aaai.org/index.php/AAAI/article/view/16788,https://dblp.org/rec/conf/aaai/FichteHM21
574,2021,Maximilian Fickert,"Saarland University, Saarbrücken, Germany",Wheeler Ruml,"University of New Hampshire, USA",AAAI,Choosing the Initial State for Online Replanning.,6,https://ojs.aaai.org/index.php/AAAI/article/view/17461,https://dblp.org/rec/conf/aaai/FickertGF0MR21
575,2021,Christian Fiedler,nan,Sebastian Trimpe,nan,AAAI,Practical and Rigorous Uncertainty Bounds for Gaussian Process Regression.,3,https://ojs.aaai.org/index.php/AAAI/article/view/16912,https://dblp.org/rec/conf/aaai/FiedlerST21
576,2021,Mihai Fieraru,nan,Cristian Sminchisescu,nan,AAAI,Learning Complex 3D Human Self-Contact.,6,https://ojs.aaai.org/index.php/AAAI/article/view/16223,https://dblp.org/rec/conf/aaai/FieraruZOPOS21
577,2021,Arnold Filtser,nan,Omrit Filtser,nan,AAAI,Condorcet Relaxation In Spatial Voting.,2,https://ojs.aaai.org/index.php/AAAI/article/view/16681,https://dblp.org/rec/conf/aaai/FiltserF21
578,2021,Mauajama Firdaus,nan,Pushpak Bhattacharyya,"Indian Institute of Technology, Bombay, India",AAAI,More the Merrier - Towards Multi-Emotion and Intensity Controllable Response Generation.,4,https://ojs.aaai.org/index.php/AAAI/article/view/17517,https://dblp.org/rec/conf/aaai/FirdausCEB21
579,2021,Fedor V. Fomin,University of Bergen,Petr A. Golovach,University of Bergen,AAAI,Present-Biased Optimization.,3,https://ojs.aaai.org/index.php/AAAI/article/view/16682,https://dblp.org/rec/conf/aaai/FominFG21
580,2021,Matthew C. Fontaine,nan,Stefanos Nikolaidis,nan,AAAI,Illuminating Mario Scenes in the Latent Space of a Generative Adversarial Network.,7,https://ojs.aaai.org/index.php/AAAI/article/view/16740,https://dblp.org/rec/conf/aaai/FontaineLKMTHN21
581,2021,Dimitris Fotakis,"National Technical University of Athens, Greece",Carmine Ventre,nan,AAAI,Efficient Truthful Scheduling and Resource Allocation through Monitoring.,3,https://ojs.aaai.org/index.php/AAAI/article/view/16683,https://dblp.org/rec/conf/aaai/FotakisKV21
582,2021,Dimitris Fotakis,"National Technical University of Athens, Greece",Stratis Skoulakis,nan,AAAI,Estimating the Number of Induced Subgraphs from Incomplete Data and Neighborhood Queries.,3,https://ojs.aaai.org/index.php/AAAI/article/view/16525,https://dblp.org/rec/conf/aaai/FotakisPS21
583,2021,Guillem Francès,nan,Hector Geffner,nan,AAAI,Learning General Planning Policies from Small Examples Without Supervision.,3,https://ojs.aaai.org/index.php/AAAI/article/view/17402,https://dblp.org/rec/conf/aaai/FrancesBG21
584,2021,Peter E. Francis,nan,Todd W. Neller,nan,AAAI,Opponent Hand Estimation in the Game of Gin Rummy.,3,https://ojs.aaai.org/index.php/AAAI/article/view/17824,https://dblp.org/rec/conf/aaai/FrancisJN21
585,2021,Tyler M. Frasca,nan,Matthias Scheutz,nan,AAAI,Enabling Fast Instruction-Based Modification of Learned Robot Skills.,4,https://ojs.aaai.org/index.php/AAAI/article/view/16757,https://dblp.org/rec/conf/aaai/FrascaOCS21
586,2021,Ahmed Frikha,nan,Volker Tresp,"Ludwig Maximilian University of Munich, Germany",AAAI,Few-Shot One-Class Classification via Meta-Learning.,4,https://ojs.aaai.org/index.php/AAAI/article/view/16913,https://dblp.org/rec/conf/aaai/FrikhaKKT21
587,2021,Xueyang Fu,nan,Xinghao Ding,nan,AAAI,Rain Streak Removal via Dual Graph Convolutional Network.,5,https://ojs.aaai.org/index.php/AAAI/article/view/16224,https://dblp.org/rec/conf/aaai/Fu0ZZD21
588,2021,Zheren Fu,nan,Yongdong Zhang 0001,"University of Science and Technology of China, National Engineering Laboratory for Brain-inspired Intelligence Technology an Application, Hefei, China",AAAI,Deep Metric Learning with Self-Supervised Ranking.,5,https://ojs.aaai.org/index.php/AAAI/article/view/16226,https://dblp.org/rec/conf/aaai/FuLMW021
589,2021,Zihao Fu,nan,Bei Shi,nan,AAAI,A Theoretical Analysis of the Repetition Problem in Text Generation.,4,https://ojs.aaai.org/index.php/AAAI/article/view/17520,https://dblp.org/rec/conf/aaai/FuLSS21
590,2021,Zhang-Hua Fu,nan,Hongyuan Zha,"Penn State, University Park, USA",AAAI,Generalize a Small Pre-trained Model to Arbitrarily Large TSP Instances.,3,https://ojs.aaai.org/index.php/AAAI/article/view/16916,https://dblp.org/rec/conf/aaai/FuQZ21
591,2021,Yao Fu,nan,Fei Huang,nan,AAAI,Nested Named Entity Recognition with Partially-Observed TreeCRFs.,5,https://ojs.aaai.org/index.php/AAAI/article/view/17519,https://dblp.org/rec/conf/aaai/FuTCHH21
592,2021,Haotian Fu,nan,Wulong Liu,nan,AAAI,Towards Effective Context for Meta-Reinforcement Learning - an Approach based on Contrastive Learning.,7,https://ojs.aaai.org/index.php/AAAI/article/view/16914,https://dblp.org/rec/conf/aaai/FuTHCFLL21
593,2021,Eugene Yujun Fu,nan,Thomas Cleary,nan,AAAI,Predicting Flashover Occurrence using Surrogate Temperature Data.,8,https://ojs.aaai.org/index.php/AAAI/article/view/17736,https://dblp.org/rec/conf/aaai/FuTWPRNLC21
594,2021,Tianfan Fu,nan,Jimeng Sun,nan,AAAI,MIMOSA - Multi-constraint Molecule Sampling for Molecule Optimization.,5,https://ojs.aaai.org/index.php/AAAI/article/view/16085,https://dblp.org/rec/conf/aaai/FuXLGS21
595,2021,Yang Fu,nan,Humphrey Shi,"University of Oregon, Eugene, OR, USA",AAAI,CompFeat - Comprehensive Feature Aggregation for Video Instance Segmentation.,5,https://ojs.aaai.org/index.php/AAAI/article/view/16225,https://dblp.org/rec/conf/aaai/FuYLHS21
596,2021,Mengying Fu,nan,Qixiang Ye,nan,AAAI,Agreement-Discrepancy-Selection - Active Learning with Progressive Distribution Alignment.,5,https://ojs.aaai.org/index.php/AAAI/article/view/16915,https://dblp.org/rec/conf/aaai/FuYWXY21
597,2021,Hao Fu,nan,Xiaolong Li,nan,AAAI,LRC-BERT - Latent-representation Contrastive Knowledge Distillation for Natural Language Understanding.,7,https://ojs.aaai.org/index.php/AAAI/article/view/17518,https://dblp.org/rec/conf/aaai/FuZYTLLL21
598,2021,Saadia Gabriel,nan,Yejin Choi,nan,AAAI,Paragraph-level Commonsense Transformers with Recurrent Memory.,6,https://ojs.aaai.org/index.php/AAAI/article/view/17521,https://dblp.org/rec/conf/aaai/GabrielBSBFC21
599,2021,Jacob Gallucci,nan,Christian Overton,nan,AAAI,Estimating Card Fitness for Discard in Gin Rummy.,4,https://ojs.aaai.org/index.php/AAAI/article/view/17825,https://dblp.org/rec/conf/aaai/GallucciBKO21
600,2021,Ting Gan,nan,Zongpeng Li,nan,AAAI,Diffusion Network Inference from Partial Observations.,6,https://ojs.aaai.org/index.php/AAAI/article/view/16918,https://dblp.org/rec/conf/aaai/GanHHYGL21
601,2021,Leilei Gan,nan,Fei Wu,nan,AAAI,Judgment Prediction via Injecting Legal Knowledge into Neural Networks.,4,https://ojs.aaai.org/index.php/AAAI/article/view/17522,https://dblp.org/rec/conf/aaai/GanKYW21
602,2021,Ji Gan,nan,Weiqiang Wang,nan,AAAI,HiGAN - Handwriting Imitation Conditioned on Arbitrary-Length Texts and Disentangled Styles.,2,https://ojs.aaai.org/index.php/AAAI/article/view/16917,https://dblp.org/rec/conf/aaai/GanW21
603,2021,Yaozhong Gan,nan,Xiaoyang Tan,nan,AAAI,Stabilizing Q Learning Via Soft Mellowmax Operator.,3,https://ojs.aaai.org/index.php/AAAI/article/view/16919,https://dblp.org/rec/conf/aaai/GanZT21
604,2021,Graeme Gange,nan,Jarrod Knibbe,nan,AAAI,Optimising Automatic Calibration of Electric Muscle Stimulation.,2,https://ojs.aaai.org/index.php/AAAI/article/view/16493,https://dblp.org/rec/conf/aaai/GangeK21
605,2021,Pritha Ganguly,nan,Pratyush Kumar,nan,AAAI,A Systematic Evaluation of Object Detection Networks for Scientific Plots.,4,https://ojs.aaai.org/index.php/AAAI/article/view/16227,https://dblp.org/rec/conf/aaai/GangulyMKK21
606,2021,Robert Ganian,"Technische Universität Wien, Austria",Sebastian Ordyniak,nan,AAAI,The Complexity of Object Association in Multiple Object Tracking.,3,https://ojs.aaai.org/index.php/AAAI/article/view/16228,https://dblp.org/rec/conf/aaai/GanianHO21
607,2021,Xiaotian Gao,nan,Mao Yang,nan,AAAI,OpEvo - An Evolutionary Method for Tensor Operator Optimization.,4,https://ojs.aaai.org/index.php/AAAI/article/view/17462,https://dblp.org/rec/conf/aaai/GaoCZY21
608,2021,Yuan Gao,nan,Christian Kroer,nan,AAAI,"Infinite-Dimensional Fisher Markets - Equilibrium, Duality and Optimization.",2,https://ojs.aaai.org/index.php/AAAI/article/view/16684,https://dblp.org/rec/conf/aaai/GaoK21
609,2021,Yuan Gao,nan,Donald Goldfarb,"Columbia University, New York City, USA",AAAI,Increasing Iterate Averaging for Solving Saddle-Point Problems.,3,https://ojs.aaai.org/index.php/AAAI/article/view/16923,https://dblp.org/rec/conf/aaai/GaoKG21
610,2021,Kai-Xin Gao,nan,Fan Yu,nan,AAAI,A Trace-restricted Kronecker-Factored Approximation to Natural Gradient.,7,https://ojs.aaai.org/index.php/AAAI/article/view/16921,https://dblp.org/rec/conf/aaai/GaoLH0WXY21
611,2021,Lei Gao,nan,Jianxin Liao,nan,AAAI,Question-Driven Span Labeling Model for Aspect-Opinion Pair Extraction.,6,https://ojs.aaai.org/index.php/AAAI/article/view/17523,https://dblp.org/rec/conf/aaai/GaoWLWZL21
612,2021,Hongchang Gao,nan,Heng Huang,"University of Pittsburgh, PA, USA",AAAI,On the Convergence of Communication-Efficient Local SGD for Federated Learning.,3,https://ojs.aaai.org/index.php/AAAI/article/view/16920,https://dblp.org/rec/conf/aaai/GaoXH21
613,2021,Zhongpai Gao,nan,Xiaokang Yang,nan,AAAI,Learning Local Neighboring Structure for Robust 3D Shape Representation.,6,https://ojs.aaai.org/index.php/AAAI/article/view/16229,https://dblp.org/rec/conf/aaai/GaoYZZYY21
614,2021,Li Gao,nan,Qian Zhang 0009,Horizon Robotics,AAAI,Addressing Domain Gap via Content Invariant Representation for Semantic Segmentation.,3,https://ojs.aaai.org/index.php/AAAI/article/view/16922,https://dblp.org/rec/conf/aaai/GaoZ021
615,2021,Prateek Garg,nan,Pratik Narang,nan,AAAI,Improving Aerial Instance Segmentation in the Dark with Self-Supervised Low Light Enhancement (Student Abstract).,3,https://ojs.aaai.org/index.php/AAAI/article/view/17887,https://dblp.org/rec/conf/aaai/GargMN21
616,2021,Nicolas Garneau,nan,Anders Søgaard,nan,AAAI,Analogy Training Multilingual Encoders.,6,https://ojs.aaai.org/index.php/AAAI/article/view/17524,https://dblp.org/rec/conf/aaai/GarneauHSRVS21
617,2021,Madelyn Gatchel,nan,Madelyn Gatchel,nan,AAAI,Analyzing Games with a Variable Number of Players.,1,https://ojs.aaai.org/index.php/AAAI/article/view/17976,https://dblp.org/rec/conf/aaai/Gatchel21
618,2021,Jiannan Ge,nan,Yongdong Zhang 0001,"University of Science and Technology of China, National Engineering Laboratory for Brain-inspired Intelligence Technology an Application, Hefei, China",AAAI,Semantic-guided Reinforced Region Embedding for Generalized Zero-Shot Learning.,4,https://ojs.aaai.org/index.php/AAAI/article/view/16230,https://dblp.org/rec/conf/aaai/GeXM021
619,2021,Michael Geden,nan,Joshua Andrews,nan,AAAI,Fair and Interpretable Algorithmic Hiring using Evolutionary Many Objective Optimization.,2,https://ojs.aaai.org/index.php/AAAI/article/view/17737,https://dblp.org/rec/conf/aaai/GedenA21
620,2021,Tobias Geibinger,nan,Nysret Musliu,"TU Wien, Vienna, Austria",AAAI,Constraint Logic Programming for Real-World Test Laboratory Scheduling.,3,https://ojs.aaai.org/index.php/AAAI/article/view/16789,https://dblp.org/rec/conf/aaai/GeibingerMM21
621,2021,Philipp Geiger,nan,Christoph-Nikolas Straehle,nan,AAAI,Learning Game-Theoretic Models of Multiagent Trajectories Using Implicit Layers.,2,https://ojs.aaai.org/index.php/AAAI/article/view/16628,https://dblp.org/rec/conf/aaai/GeigerS21
