219,219,Jiayu Zhou,Arizona State University,Jieping Ye,Arizona State University,Clustered Multi-Task Learning Via Alternating Structure Optimization.
220,220,Yoonho Hwang,POSTECH,Hee-Kap Ahn,POSTECH,Convergent Bounds on the Euclidean Distance.
221,221,Jia Deng,Princeton University,Li Fei-Fei,Stanford University,Fast and Balanced: Efficient Label Tree Learning for Large Scale Object Recognition.
222,222,Lei Yuan,Arizona State University,Jieping Ye,Arizona State University,Efficient Methods for Overlapping Group Lasso.
223,223,Flavio Chierichetti,Sapienza University,David Liben-Nowell,Carleton College,Reconstructing Patterns of Information Diffusion from Incomplete Observations.
224,224,Nicolas Boumal,EPFL,Pierre-Antoine Absil,U.C.Louvain,RTRMC: A Riemannian trust-region method for low-rank matrix completion.
225,225,Samory Kpotufe,Princeton University,Samory Kpotufe,Princeton University,k-NN Regression Adapts to Local Intrinsic Dimension.
226,226,Ali Jalali,University of Texas at Austin,Pradeep Ravikumar,Carnegie Mellon University,On Learning Discrete Graphical Models using Greedy Methods.
227,227,Phillip Isola,Massachusetts Institute of Technology,Aude Oliva,MIT,Understanding the Intrinsic Memorability of Images.
228,228,Mona Eberts,University of Stuttgart,Ingo Steinwart,University of Stuttgart,Optimal learning rates for least squares SVMs using Gaussian kernels.
229,229,Kenji Fukumizu,Institute of Statistical Mathematics / Preferred Networks / RIKEN AIP,Arthur Gretton,"Gatsby Unit, UCL",Kernel Bayes' Rule.
230,230,Adrian Ion,TU Wien & IST Austria,Cristian Sminchisescu,Lund University/Google,Probabilistic Joint Image Segmentation and Labeling.
231,231,Dmitry Pidan,Technion,Ran El-Yaniv,Technion & Google,Selective Prediction of Financial Trends with Hidden Markov Models.
232,232,Mladen Kolar,University of Chicago,Aarti Singh,CMU,Minimax Localization of Structural Information in Large Noisy Matrices.
233,233,yan karklin,Knewton,Eero Simoncelli,FlatIron Institute / New York University,Efficient coding with a population of Linear-Nonlinear neurons.
234,234,Kamil A Wnuk,"University of California, Los Angeles",Stefano Soatto,UCLA,Multiple Instance Filtering.
235,235,Alekh Agarwal,Microsoft Research,John Duchi,UC Berkeley,Distributed Delayed Stochastic Optimization.
236,236,Yasin Abbasi Yadkori,DeepMind,Csaba Szepesvari,DeepMind / University of Alberta,Improved Algorithms for Linear Stochastic Bandits.
237,237,Martin O Larsson,Operations Research and Information Engineering / Cornell University,Johan Ugander,Stanford University,A concave regularization technique for sparse mixture models.
238,238,Pannagadatta K Shivaswamy,Cornell University,Tony Jebara,Spotify,Variance Penalizing AdaBoost.
