,first-author-affiliation,last-author-affiliation,title
0," Duke University, Department of Computer Science, Durham, NC"," Duke University, Department of Computer Science, Durham, NC",Distance minimization for reward learning from scored trajectories
1," Department of Computer Science and Techn, State Key Lab on Int. Techn. and Systems, Tsinghua National Lab for Information Science and Techn. (TNList), Tsinghua Univ, Beijing, China and Department of Computing and Inf. Systems, The Univ of Melbourne, Parkville, VIC, Australia"," Department of Computing and Information Systems, The University of Melbourne, Parkville, VIC, Australia",Efficient spatio-temporal tactile object recognition with randomized tiling convolutional networks in a hierarchical fusion strategy
2," Knowledge-Based Systems Group, RWTH Aachen University, Germany"," Knowledge-Based Systems Group, RWTH Aachen University, Germany",Continual planning in Golog
3," School of Computer Science. Carnegie Mellon University, Pittsburgh, PA"," School of Computer Science. Carnegie Mellon University, Pittsburgh, PA",Selectively Reactive Coordination for a team of robot soccer champions
4," Mobile Robotics Group, University of Oxford, United Kingdom"," Mobile Robotics Group, University of Oxford, United Kingdom",Deep tracking: seeing beyond seeing using recurrent neural networks
