,Unnamed: 0,first-author,first-author-gender,first-author-affiliation,last-author,last-author-gender,last-author-affiliation,title
354,354,Dinesh Ramasamy,Male,Amazon Lab126,Upamanyu Madhow,Male,UC Santa Barbara,Compressive spectral embedding: sidestepping the SVD.
355,355,Cynthia Dwork,Female,Microsoft Research,Aaron Roth,Male,University of Pennsylvania,Generalization in Adaptive Data Analysis and Holdout Reuse.
356,356,Róbert Busa-Fekete,Male,UPB,Eyke Hüllermeier,Male,Marburguniversity,Online F-Measure Optimization.
357,357,Kai-Yang Chiang,Male,UT Austin,Inderjit Dhillon,Male,University of Texas at Austin,Matrix Completion with Noisy Side Information.
358,358,Bo Waggoner,Male,Harvard,Jacob D Abernethy,Male,University of Michigan,A Market Framework for Eliciting Private Data.
359,359,Yen-Chi Chen,Male,Carnegie Mellon University,Larry Wasserman,Male,Carnegie Mellon University,Optimal Ridge Detection using Coverage Risk.
360,360,Gustavo Malkomes,Male,Washington University in St. Louis,Benjamin Moseley,Male,Washington University in St Lo,Fast Distributed k-Center Clustering with Outliers on Massive Data.
361,361,Megasthenis Asteris,Male,University of Texas at Austin,Alex Dimakis,Male,"University of Texas, Austin",Orthogonal NMF through Subspace Exploration.
362,362,Tianyang Li,Male,UT Austin,Pradeep Ravikumar,Male,University of Texas at Austin,Fast Classification Rates for High-dimensional Gaussian Generative Models.
363,363,T.-K. Huang,Male,Microsoft,Robert Schapire,Male,MIcrosoft Research,Efficient and Parsimonious Agnostic Active Learning.
364,364,Nikhil Rao,Male,University of Texas at Austin,Inderjit Dhillon,Male,University of Texas at Austin,Collaborative Filtering with Graph Information: Consistency and Scalable Methods.
365,365,Alessandro Rudi,Male,University of Genova,Lorenzo Rosasco,Male,University of Genova,Less is More: Nyström Computational Regularization.
366,366,Prateek Jain,Male,Microsoft Research,Ambuj Tewari,Male,University of Michigan,Predtron: A Family of Online Algorithms for General Prediction Problems.
367,367,Weiwei Liu,Female,UTS,Ivor Tsang,Male,"University of Technology, Sydney",On the Optimality of Classifier Chain for Multi-label Classification.
368,368,Bryan He,Male,Stanford University,Yisong Yue,Male,Caltech,Smooth Interactive Submodular Set Cover.
369,369,Janne H Korhonen,Male,University of Helsinki,Pekka Parviainen,Male,Aalto University,Tractable Bayesian Network Structure Learning with Bounded Vertex Cover Number.
370,370,Peter Kairouz,Male,UIUC,Pramod Viswanath,Male,UIUC,Secure Multi-party Differential Privacy.
371,371,Zhan Wei Lim,Male,NUS,Wee Sun Lee,Male,National University of Singapore,Adaptive Stochastic Optimization: From Sets to Paths.
372,372,Siqi Sun,Male,TTIC,Jinbo Xu,Male,Toyota Technological Institute at Chicago,Learning structured densities via infinite dimensional exponential families.
373,373,Anastasia Pentina,Female,IST Austria,Christoph Lampert,Male,IST Austria,Lifelong Learning with Non-i.i.d. Tasks.
374,374,Brendan van Rooyen,Male,NICTA,Robert Williamson,Male,NICTA,Learning with Symmetric Label Noise: The Importance of Being Unhinged.
375,375,Huasen Wu,Male,University of California at Davis,Chong Jiang,Male,University of Illinois at Urbana-Champaign,Algorithms with Logarithmic or Sublinear Regret for  Constrained Contextual Bandits.
376,376,Tatsunori Hashimoto,Male,MIT CSAIL,Tommi Jaakkola,Male,MIT,From random walks to distances on unweighted graphs.
377,377,Kush Bhatia,Male,Microsoft Research,Puru Kar,Male,Indian Institute of Technology Kanpur,Robust Regression via Hard Thresholding.
378,378,Saurabh Paul,Male,Paypal Inc,Petros Drineas,Male,Rensselaer Polytechnic Institute,Column Selection via Adaptive Sampling.
379,379,Yunwen Lei,Male,City University of Hong Kong,Marius Kloft,Male,Humboldt University of Berlin,Multi-class SVMs: From Tighter Data-Dependent Generalization Bounds to Novel Algorithms.
380,380,Xinyang Yi,Male,Utaustin,Han Liu,Male,Princeton University,Optimal Linear Estimation under Unknown Nonlinear Transform.
381,381,Yinlam Chow,Male,Stanford,Marco Pavone,Male,Stanford University,Risk-Sensitive and Robust Decision-Making: a CVaR Optimization Approach.
382,382,Lorenzo Rosasco,Male,University of Genova,Silvia Villa,Male,IIT-MIT,Learning with Incremental Iterative Regularization.
383,383,Jason Hartline,Male,Northwestern University,Eva Tardos,Female,Cornell University,No-Regret Learning in Bayesian Games.
384,384,Parikshit Shah,Male,Yahoo Labs,Gongguo Tang,Male,Colorado School of Mines,Sparse and Low-Rank Tensor Decomposition.
385,385,Huishuai Zhang,Male,Syracuse University,Yingbin Liang,Male,Syracuse Univeristy,Analysis of Robust PCA via Local Incoherence.
386,386,Ibrahim M Alabdulmohsin,Male,King Abdullah University of Science and Technology (KAUST),Ibrahim M Alabdulmohsin,Male,King Abdullah University of Science and Technology (KAUST),Algorithmic Stability and Uniform Generalization.
387,387,Daniel Hsu,Male,Columbia University,Csaba Szepesvari,Male,University of Alberta,Mixing Time Estimation in Reversible Markov Chains from a Single Sample Path.
388,388,Sohail Bahmani,Male,Georgia Tech.,Justin Romberg,Male,Georgia Institute of Technology,Efficient Compressive Phase Retrieval with Constrained Sensing Vectors.
389,389,Suriya Gunasekar,Male,UT Austin,Joydeep Ghosh,Male,UT Austin,Unified View of Matrix Completion under General Structural Constraints.
390,390,Masrour Zoghi,Male,University of Amsterdam,Maarten de Rijke,Male,University of Amsterdam,Copeland Dueling Bandits.
391,391,Junpei Komiyama,Male,The University of Tokyo,Hiroshi Nakagawa,Male,The University of Tokyo,Regret Lower Bound and Optimal Algorithm in Finite Stochastic Partial Monitoring.
392,392,Oren Anava,Male,Technion,Shie Mannor,Male,Technion,Online Learning for Adversaries with Memory: Price of Past Mistakes.
393,393,Mehryar Mohri,Male,Courant Institute and Google,Andres Munoz,Male,Google,Revenue Optimization against Strategic Buyers.
394,394,Wei Cao,Male,Tsinghua University,Zhize Li,Male,Tsinghua University,On Top-k Selection in Multi-Armed Bandits and Hidden Bipartite Graphs.
395,395,Ruoyu Sun,Male,Stanford university,Mingyi Hong,Male,iowa state university,Improved Iteration Complexity Bounds of Cyclic Block Coordinate Descent for Convex Problems.
396,396,Julien Audiffren,Male,"CMLA, ENS Cachan",Liva Ralaivola,Male,"LIF, Aix-Marseille University, CNRS",Cornering Stationary and Restless Mixing Bandits with Remix-UCB.
397,397,Jacob D Abernethy,Male,University of Michigan,Ambuj Tewari,Male,University of Michigan,Fighting Bandits with a New Kind of Smoothness.
398,398,Tum Chaturapruek,Male,Stanford University,Chris Ré,Male,Stanford,Asynchronous stochastic convex optimization: the noise is in the noise and SGD don't care.
399,399,Tor Lattimore,Male,University of Alberta,Tor Lattimore,Male,University of Alberta,The Pareto Regret Frontier for Bandits.
400,400,Yifan Wu,Male,University of Alberta,Csaba Szepesvari,Male,University of Alberta,Online Learning with Gaussian Payoffs and Side Observations.
401,401,Tomer Koren,Male,Technion,Kfir Y. Levy,Male,Technion,Fast Rates for Exp-concave Empirical Risk Minimization.
402,402,Theodoros Tsiligkaridis,Male,MIT Lincoln Laboratory,Keith Forsythe,Male,MIT Lincoln Laboratory,Adaptive Low-Complexity Sequential Inference for Dirichlet Process Mixture Models.
