,year,first-author,first-author-affiliation,last-author,last-author-affiliation,journal/conference,title,number-of-authors,paper-url,DBLP-url
433,2019,Thibault Laugel,nan,Marcin Detyniecki,"LIP6, Paris",IJCAI,The Dangers of Post-hoc Interpretability - Unjustified Counterfactual Explanations.,5,https://doi.org/10.24963/ijcai.2019/388,https://dblp.org/rec/conf/ijcai/LaugelLMRD19
434,2019,Trung Le,nan,Dinh Q. Phung,"Monash University, Melbourne, Victoria, Australia",IJCAI,Learning Generative Adversarial Networks from Multiple Data Sources.,6,https://doi.org/10.24963/ijcai.2019/391,https://dblp.org/rec/conf/ijcai/LeHVNBP19
435,2019,Dung D. Le,nan,Hady W. Lauw,Singapore Management University,IJCAI,Learning Multiple Maps from Conditional Ordinal Triplets.,2,https://doi.org/10.24963/ijcai.2019/390,https://dblp.org/rec/conf/ijcai/LeL19
436,2019,Duc-Trong Le,nan,Yuan Fang 0001,"Singapore Management University, School of Information Systems, Singapore",IJCAI,Correlation-Sensitive Next-Basket Recommendation.,3,https://doi.org/10.24963/ijcai.2019/389,https://dblp.org/rec/conf/ijcai/LeLF19
437,2019,Nam Lê Tien,"ENS Lyon, France",Marc Sebban,nan,IJCAI,Differentially Private Optimal Transport - Application to Domain Adaptation.,3,https://doi.org/10.24963/ijcai.2019/395,https://dblp.org/rec/conf/ijcai/LeTienHS19
438,2019,Haralambie Leahu,nan,Tim Baarslag,nan,IJCAI,Automated Negotiation with Gaussian Process-based Utility Models.,3,https://doi.org/10.24963/ijcai.2019/60,https://dblp.org/rec/conf/ijcai/LeahuKB19
439,2019,Freddy Lécué,nan,Huajun Chen,nan,IJCAI,Augmenting Transfer Learning with Semantic Reasoning.,4,https://doi.org/10.24963/ijcai.2019/246,https://dblp.org/rec/conf/ijcai/LecueCPC19
440,2019,Min Hun Lee,nan,Min Hun Lee,nan,IJCAI,Intelligent Agent for Assessing and Guiding Rehabilitation Exercises.,1,https://doi.org/10.24963/ijcai.2019/911,https://dblp.org/rec/conf/ijcai/Lee19
441,2019,Dongha Lee,nan,Hwanjo Yu,nan,IJCAI,Action Space Learning for Heterogeneous User Behavior Prediction.,5,https://doi.org/10.24963/ijcai.2019/392,https://dblp.org/rec/conf/ijcai/LeePJHY19
442,2019,Donghun Lee,nan,Finale Doshi-Velez,"MIT Computer Science and Artificial Intelligence Laboratory, Cambridge, USA",IJCAI,Truly Batch Apprenticeship Learning with Deep Successor Features.,3,https://doi.org/10.24963/ijcai.2019/819,https://dblp.org/rec/conf/ijcai/LeeSD19
443,2019,Seungwon Lee,nan,Eric Eaton,nan,IJCAI,Learning Shared Knowledge for Deep Lifelong Learning using Deconvolutional Networks.,3,https://doi.org/10.24963/ijcai.2019/393,https://dblp.org/rec/conf/ijcai/LeeSE19
444,2019,Kehua Lei,nan,Zhihan Yang,nan,IJCAI,Design and Implementation of a Disambiguity Framework for Smart Voice Controlled Devices.,5,https://doi.org/10.24963/ijcai.2019/948,https://dblp.org/rec/conf/ijcai/LeiMJZY19
445,2019,Qi Lei,nan,Inderjit S. Dhillon,"University of Texas at Austin, USA",IJCAI,Similarity Preserving Representation Learning for Time Series Clustering.,5,https://doi.org/10.24963/ijcai.2019/394,https://dblp.org/rec/conf/ijcai/LeiYVWD19
446,2019,Domenico Lembo,nan,Domenico Fabio Savo,"University of Bergamo, Department of Management, Information and Production Engineering, Italy",IJCAI,Revisiting Controlled Query Evaluation in Description Logics.,3,https://doi.org/10.24963/ijcai.2019/247,https://dblp.org/rec/conf/ijcai/LemboRS19
447,2019,Priel Levy,nan,Yonatan Aumann,nan,IJCAI,Temporal Information Design in Contests.,3,https://doi.org/10.24963/ijcai.2019/61,https://dblp.org/rec/conf/ijcai/LevySA19
448,2019,Xiaosheng Li,nan,Liang Zhao 0002,"George Mason University, Department of Information Science and Technology, Fairfax, VA, USA",IJCAI,Linear Time Complexity Time Series Clustering with Symbolic Pattern Forest.,3,https://doi.org/10.24963/ijcai.2019/406,https://dblp.org/rec/conf/ijcai/Li0Z19
449,2019,Yu Li,nan,Yi Chang 0001,Huawei Research America,IJCAI,Learning Network Embedding with Community Structural Information.,5,https://doi.org/10.24963/ijcai.2019/407,https://dblp.org/rec/conf/ijcai/Li0ZZC19
450,2019,Ziming Li,nan,Ziming Li,nan,IJCAI,Optimizing Interactive Systems with Data-Driven Objectives.,1,https://doi.org/10.24963/ijcai.2019/912,https://dblp.org/rec/conf/ijcai/Li19
451,2019,Jing Li,nan,Jing Li,nan,IJCAI,Neural Discourse Segmentation.,1,https://doi.org/10.24963/ijcai.2019/949,https://dblp.org/rec/conf/ijcai/Li19a
452,2019,Jun Li,nan,Shuiwang Ji,"Old Dominion University, Norfolk, USA",IJCAI,Dense Transformer Networks for Brain Electron Microscopy Image Segmentation.,5,https://doi.org/10.24963/ijcai.2019/401,https://dblp.org/rec/conf/ijcai/LiCCDJ19
453,2019,Zhongyang Li,nan,Ting Liu 0001,"Harbin Institute of Technology, Research Center for Social Computing and Information Retrieval, China",IJCAI,Story Ending Prediction by Transferable BERT.,3,https://doi.org/10.24963/ijcai.2019/249,https://dblp.org/rec/conf/ijcai/LiDL19
454,2019,Jiaoyang Li 0001,"University of Southern California, CA, USA",Sven Koenig,nan,IJCAI,Improved Heuristics for Multi-Agent Path Finding with Conflict-Based Search.,5,https://doi.org/10.24963/ijcai.2019/63,https://dblp.org/rec/conf/ijcai/LiFB0K19
455,2019,Bin Li 0035,"University of Electronic Science and Technology of China, Chengdu, China",Makoto Yokoo,nan,IJCAI,Diffusion and Auction on Graphs.,4,https://doi.org/10.24963/ijcai.2019/62,https://dblp.org/rec/conf/ijcai/LiHZY19
456,2019,Chong Li,nan,Hongxia Yang,nan,IJCAI,Hierarchical Representation Learning for Bipartite Graphs.,5,https://doi.org/10.24963/ijcai.2019/398,https://dblp.org/rec/conf/ijcai/LiJSSY19
457,2019,Jian Li 0040,"Chinese Academy of Sciences, Institute of Information Engineering, Beijing, China",Weiping Wang 0005,"Chinese Academy of Sciences, Institute of Information Engineering, Beijing, China",IJCAI,Multi-Class Learning using Unlabeled Samples - Theory and Algorithm.,4,https://doi.org/10.24963/ijcai.2019/399,https://dblp.org/rec/conf/ijcai/LiLY019
458,2019,Jian Li 0040,"Chinese Academy of Sciences, Institute of Information Engineering, Beijing, China",Weiping Wang 0005,"Chinese Academy of Sciences, Institute of Information Engineering, Beijing, China",IJCAI,Approximate Manifold Regularization - Scalable Algorithm and Generalization Analysis.,4,https://doi.org/10.24963/ijcai.2019/400,https://dblp.org/rec/conf/ijcai/LiLY019a
459,2019,Ying Li,nan,Luo Si,Purdue University,IJCAI,Self-attentive Biaffine Dependency Parsing.,6,https://doi.org/10.24963/ijcai.2019/704,https://dblp.org/rec/conf/ijcai/LiLZWLS19
460,2019,Chenliang Li,nan,Cong Quan,nan,IJCAI,A Review-Driven Neural Model for Sequential Recommendation.,5,https://doi.org/10.24963/ijcai.2019/397,https://dblp.org/rec/conf/ijcai/LiNLCQ19
461,2019,Ang Li,nan,Judea Pearl,Turing Award,IJCAI,Unit Selection Based on Counterfactual Logic.,2,https://doi.org/10.24963/ijcai.2019/248,https://dblp.org/rec/conf/ijcai/LiP19
462,2019,Ang Li,nan,Kotagiri Ramamohanarao,"University of Melbourne, School of Computing and Information Systems, Australia",IJCAI,Generative Image Inpainting with Submanifold Alignment.,5,https://doi.org/10.24963/ijcai.2019/114,https://dblp.org/rec/conf/ijcai/LiQZMR19
463,2019,Runnan Li,nan,Helen Meng,蒙美玲,IJCAI,Towards Discriminative Representation Learning for Speech Emotion Recognition.,6,https://doi.org/10.24963/ijcai.2019/703,https://dblp.org/rec/conf/ijcai/LiW0BZM19
464,2019,Zhe Li,nan,Jian Cheng 0001,程健,IJCAI,Reading selectively via Binary Input Gated Recurrent Unit.,4,https://doi.org/10.24963/ijcai.2019/705,https://dblp.org/rec/conf/ijcai/LiWLC19
465,2019,Zhaoyang Li,nan,Zhaohua Yang,nan,IJCAI,Deep Adversarial Multi-view Clustering Network.,5,https://doi.org/10.24963/ijcai.2019/409,https://dblp.org/rec/conf/ijcai/LiWTGY19
466,2019,Jinning Li,nan,Yexiang Xue,nan,IJCAI,Scribble-to-Painting Transformation with Multi-Task Generative Adversarial Networks.,2,https://doi.org/10.24963/ijcai.2019/820,https://dblp.org/rec/conf/ijcai/LiX19
467,2019,Zhaoqun Li,nan,Biao Leng,nan,IJCAI,Rethinking Loss Design for Large-scale 3D Shape Retrieval.,3,https://doi.org/10.24963/ijcai.2019/118,https://dblp.org/rec/conf/ijcai/LiXL19
468,2019,Minglong Li,nan,Ji Wang,nan,IJCAI,Integrating Decision Sharing with Prediction in Decentralized Planning for Multi-Agent Coordination under Uncertainty.,5,https://doi.org/10.24963/ijcai.2019/64,https://dblp.org/rec/conf/ijcai/LiYCYW19
469,2019,Jiawei Li 0003,"Hong Kong Baptist University, Hong Kong, China",Pong C. Yuen,阮邦志,IJCAI,Variation Generalized Feature Learning via Intra-view Variation Adaptation.,4,https://doi.org/10.24963/ijcai.2019/116,https://dblp.org/rec/conf/ijcai/LiYMY19
470,2019,Longyuan Li,nan,Yaohui Jin,nan,IJCAI,Learning Interpretable Deep State Space Model for Probabilistic Time Series Forecasting.,4,https://doi.org/10.24963/ijcai.2019/402,https://dblp.org/rec/conf/ijcai/LiYYJ19
471,2019,Pengcheng Li,nan,Lijun Zhang,nan,IJCAI,Improving the Robustness of Deep Neural Networks via Adversarial Training with Triplet Loss.,4,https://doi.org/10.24963/ijcai.2019/403,https://dblp.org/rec/conf/ijcai/LiYZZ19
472,2019,Qiaozhe Li,nan,Kaiqi Huang,nan,IJCAI,Pedestrian Attribute Recognition by Joint Visual-semantic Reasoning and Knowledge Distillation.,4,https://doi.org/10.24963/ijcai.2019/117,https://dblp.org/rec/conf/ijcai/LiZHH19
473,2019,Zhangheng Li,nan,Ge Li 0002,"Peking University Shenzhen Graduate School, School of Electronic and Computer Engineering, Shenzhen, China",IJCAI,ARMIN - Towards a More Efficient and Light-weight Recurrent Memory Network.,6,https://doi.org/10.24963/ijcai.2019/408,https://dblp.org/rec/conf/ijcai/LiZHZLL19
474,2019,Ruihuang Li,nan,Zheng Wang,nan,IJCAI,Flexible Multi-View Representation Learning for Subspace Clustering.,5,https://doi.org/10.24963/ijcai.2019/404,https://dblp.org/rec/conf/ijcai/LiZHZW19
475,2019,Linyi Li,nan,Tao Xie 0001,"University of Illinois at Urbana-Champaign, Department of Computer Science, IL, USA",IJCAI,Robustra - Training Provable Robust Neural Networks over Reference Adversarial Space.,4,https://doi.org/10.24963/ijcai.2019/654,https://dblp.org/rec/conf/ijcai/LiZL019
476,2019,Ziyao Li,nan,Guojie Song,"Peking University, Beijing, China",IJCAI,GCN-LASE - Towards Adequately Incorporating Link Attributes in Graph Convolutional Networks.,3,https://doi.org/10.24963/ijcai.2019/410,https://dblp.org/rec/conf/ijcai/LiZS19
477,2019,Peiyao Li,nan,Jia Wu 0001,"Macquarie University, Sydney, Australia",IJCAI,CoTrRank - Trust Evaluation of Users and Tweets.,4,https://doi.org/10.24963/ijcai.2019/950,https://dblp.org/rec/conf/ijcai/LiZY019
478,2019,Rongzhong Lian,nan,Hua Wu,nan,IJCAI,Learning to Select Knowledge for Response Generation in Dialog Systems.,5,https://doi.org/10.24963/ijcai.2019/706,https://dblp.org/rec/conf/ijcai/LianXWPW19
479,2019,Xiaoyuan Liang,nan,Guiling Wang,nan,IJCAI,Learning K-way D-dimensional Discrete Embedding for Hierarchical Data Visualization and Retrieval.,4,https://doi.org/10.24963/ijcai.2019/411,https://dblp.org/rec/conf/ijcai/LiangMGW19
480,2019,Shuangli Liao,nan,Xiangdong Zhang,nan,IJCAI,Worst-Case Discriminative Feature Selection.,5,https://doi.org/10.24963/ijcai.2019/412,https://dblp.org/rec/conf/ijcai/LiaoGNLZ19
481,2019,Baihan Lin,nan,Guillermo A. Cecchi,nan,IJCAI,Split Q Learning - Reinforcement Learning with Two-Stream Rewards.,3,https://doi.org/10.24963/ijcai.2019/913,https://dblp.org/rec/conf/ijcai/LinBC19
482,2019,Weibo Lin,nan,Mingyu Xiao,nan,IJCAI,Balanced Clustering - A Uniform Model and Fast Algorithm.,3,https://doi.org/10.24963/ijcai.2019/414,https://dblp.org/rec/conf/ijcai/LinHX19
483,2019,Luojun Lin,nan,Weijie Chen,nan,IJCAI,Attribute-Aware Convolutional Neural Networks for Facial Beauty Prediction.,4,https://doi.org/10.24963/ijcai.2019/119,https://dblp.org/rec/conf/ijcai/LinLJC19
484,2019,Shu Lin 0003,"Peking University, Department of Computer Science and Technolog, Beijing, China",Wenxin Li,nan,IJCAI,Optimizing Constraint Solving via Dynamic Programming.,3,https://doi.org/10.24963/ijcai.2019/160,https://dblp.org/rec/conf/ijcai/LinML19
485,2019,Jianxin Lin,nan,Zhibo Chen 0001,"University of Science and Technology of China, Hefei, China",IJCAI,Image-to-Image Translation with Multi-Path Consistency Regularization.,5,https://doi.org/10.24963/ijcai.2019/413,https://dblp.org/rec/conf/ijcai/LinXWQ019
486,2019,Peiqin Lin,nan,Jianhuang Lai,nan,IJCAI,Deep Mask Memory Network with Semantic Dependency and Context Moment for Aspect Level Sentiment Classification.,3,https://doi.org/10.24963/ijcai.2019/707,https://dblp.org/rec/conf/ijcai/LinYL19
487,2019,Fei Liu,nan,Hanqing Lu,nan,IJCAI,Densely Connected Attention Flow for Visual Question Answering.,5,https://doi.org/10.24963/ijcai.2019/122,https://dblp.org/rec/conf/ijcai/Liu0FHL19
488,2019,Yuliang Liu,nan,Zhepeng Wang,nan,IJCAI,Omnidirectional Scene Text Detection with Sequential-free Box Discretization.,6,https://doi.org/10.24963/ijcai.2019/423,https://dblp.org/rec/conf/ijcai/Liu0JXWW19
489,2019,Kai Liu 0018,"Colorado School of Mines, Department of Computer Science, Golden, CO, USA",Feiping Nie 0001,"Northwestern Polytechnical University, School of Computer Science, OPTIMAL, Xi'an, China",IJCAI,Learning Robust Distance Metric with Side Information via Ratio Minimization of Orthogonally Constrained L21-Norm Distances.,4,https://doi.org/10.24963/ijcai.2019/417,https://dblp.org/rec/conf/ijcai/LiuB0N19
490,2019,Ruixue Liu,nan,Xiaodong He 0002,"JD AI Research, Mountain View, CA, USA",IJCAI,Mappa Mundi - An Interactive Artistic Mind Map Generator with Artificial Imagination.,6,https://doi.org/10.24963/ijcai.2019/951,https://dblp.org/rec/conf/ijcai/LiuCCWQH19
491,2019,Qianlong Liu,nan,Kam-Fai Wong,Chinese University of Hong Kong,IJCAI,Building Personalized Simulator for Interactive Search.,9,https://doi.org/10.24963/ijcai.2019/710,https://dblp.org/rec/conf/ijcai/LiuCWPHDHHW19
492,2019,Lydia T. Liu,nan,Moritz Hardt,nan,IJCAI,Delayed Impact of Fair Machine Learning.,5,https://doi.org/10.24963/ijcai.2019/862,https://dblp.org/rec/conf/ijcai/LiuDRSH19
493,2019,Chunlei Liu 0001,"Beihang University, Beijing, China",Guodong Guo,nan,IJCAI,Rectified Binary Convolutional Networks for Enhancing the Performance of 1-bit DCNNs.,8,https://doi.org/10.24963/ijcai.2019/120,https://dblp.org/rec/conf/ijcai/LiuDXHZLZG19
494,2019,Zhongzhou Liu,nan,Wenbin Hu,nan,IJCAI,FSM - A Fast Similarity Measurement for Gene Regulatory Networks via Genes' Influence Power.,2,https://doi.org/10.24963/ijcai.2019/632,https://dblp.org/rec/conf/ijcai/LiuH19
495,2019,Yong Liu,nan,Changjie Fan,nan,IJCAI,Value Function Transfer for Deep Multi-Agent Reinforcement Learning Based on N-Step Returns.,5,https://doi.org/10.24963/ijcai.2019/65,https://dblp.org/rec/conf/ijcai/LiuHGCF19
496,2019,Yusen Liu,nan,Yi Zhou,nan,IJCAI,How Well Do Machines Perform on IQ tests - a Comparison Study on a Large-Scale Dataset.,6,https://doi.org/10.24963/ijcai.2019/846,https://dblp.org/rec/conf/ijcai/LiuHZRFZ19
497,2019,Chihuang Liu,nan,Joseph JáJá,"University of Maryland, College Park, USA",IJCAI,Feature Prioritization and Regularization Improve Standard Accuracy and Adversarial Robustness.,2,https://doi.org/10.24963/ijcai.2019/415,https://dblp.org/rec/conf/ijcai/LiuJ19
498,2019,Jie Liu 0007,"Nankai University, Tianjin, China",Zhicheng He,nan,IJCAI,Network Embedding with Dual Generation Tasks.,3,https://doi.org/10.24963/ijcai.2019/709,https://dblp.org/rec/conf/ijcai/LiuLH19
499,2019,Wen Liu 0003,"ShanghaiTech University, School of Information Science and Technology, China",Shenghua Gao,nan,IJCAI,Margin Learning Embedded Prediction for Video Anomaly Detection with A Few Anomalies.,5,https://doi.org/10.24963/ijcai.2019/419,https://dblp.org/rec/conf/ijcai/LiuLLZG19
500,2019,Zhi Gang Liu,nan,Matthew Mattina,nan,IJCAI,Learning Low-precision Neural Networks without Straight-Through Estimator (STE).,2,https://doi.org/10.24963/ijcai.2019/425,https://dblp.org/rec/conf/ijcai/LiuM19
501,2019,Xingbo Liu,nan,Yilong Yin,nan,IJCAI,Supervised Short-Length Hashing.,6,https://doi.org/10.24963/ijcai.2019/420,https://dblp.org/rec/conf/ijcai/LiuNZX0Y19
502,2019,Tianlong Liu,nan,Jianan Yan,nan,IJCAI,Locate-Then-Detect - Real-time Web Attack Detection via Attention-based Deep Neural Networks.,4,https://doi.org/10.24963/ijcai.2019/656,https://dblp.org/rec/conf/ijcai/LiuQSY19
503,2019,Fenglin Liu,nan,Xu Sun 0001,"Peking University, School of EECS, MOE Key Lab of Computational Linguistics, China",IJCAI,Exploring and Distilling Cross-Modal Information for Image Captioning.,5,https://doi.org/10.24963/ijcai.2019/708,https://dblp.org/rec/conf/ijcai/LiuRLL019
504,2019,Yuanyuan Liu 0001,"Chinese University of Hong Kong, Department of Computer Science and Engineering",Licheng Jiao,焦李成,IJCAI,Accelerated Incremental Gradient Descent using Momentum Acceleration with Scaling Factor.,3,https://doi.org/10.24963/ijcai.2019/422,https://dblp.org/rec/conf/ijcai/LiuSJ19
505,2019,Chuanjian Liu,nan,Chang Xu 0002,"University of Sydney, School of Information Technologies, UBTECH Sydney Artificial Intelligence Centre, NSW, Australia",IJCAI,Learning Instance-wise Sparsity for Accelerating Deep Models.,5,https://doi.org/10.24963/ijcai.2019/416,https://dblp.org/rec/conf/ijcai/LiuWHXX19
506,2019,Yang Liu 0069,"Xidian University, State Key Laboratory of Integrated Services Networks, Xi'an, China",Xinbo Gao 0001,高新波,IJCAI,Graph and Autoencoder Based Feature Extraction for Zero-shot Learning.,6,https://doi.org/10.24963/ijcai.2019/421,https://dblp.org/rec/conf/ijcai/LiuXGHWG19
507,2019,Zheng Liu,nan,Xing Xie 0001,谢幸,IJCAI,Hi-Fi Ark - Deep User Representation via High-Fidelity Archive Network.,5,https://doi.org/10.24963/ijcai.2019/424,https://dblp.org/rec/conf/ijcai/LiuXWAX19
508,2019,Jen-Yu Liu,nan,Yi-Hsuan Yang,nan,IJCAI,Dilated Convolution with Dilated GRU for Music Source Separation.,2,https://doi.org/10.24963/ijcai.2019/655,https://dblp.org/rec/conf/ijcai/LiuY19
509,2019,Ziquan Liu,nan,Antoni B. Chan,"City University of Hong Kong, Department of Computer Science",IJCAI,Parametric Manifold Learning of Gaussian Mixture Models.,4,https://doi.org/10.24963/ijcai.2019/426,https://dblp.org/rec/conf/ijcai/LiuYHC19
510,2019,Dongnan Liu,nan,Weidong Cai 0001,"University of Sydney, Australia",IJCAI,Nuclei Segmentation via a Deep Panoptic Model with Semantic Feature Fusion.,7,https://doi.org/10.24963/ijcai.2019/121,https://dblp.org/rec/conf/ijcai/LiuZ0ZZOC19
511,2019,Tianyu Liu,nan,Lingyang Song,nan,IJCAI,Playing Card-Based RTS Games with Deep Reinforcement Learning.,5,https://doi.org/10.24963/ijcai.2019/631,https://dblp.org/rec/conf/ijcai/LiuZLBS19
512,2019,Lu Liu,nan,Chengqi Zhang,"University of Technology Sydney, Centre for Artificial Intelligence, FEIT, Ultimo, NSW, Australia",IJCAI,Prototype Propagation Networks (PPN) for Weakly-supervised Few-shot Learning on Category Graph.,6,https://doi.org/10.24963/ijcai.2019/418,https://dblp.org/rec/conf/ijcai/LiuZLJYZ19
513,2019,Liang Liu 0007,"Zhejiang University, Department of Control Science and Engineering, Institute of Cyber-Systems and Control, Hangzhou, China",Yong Liu 0007,"Zhejiang University, Institute of Cyber-Systems and Control, State Key Laboratory of Industrial Control Technology, Hangzhou, China",IJCAI,Unsupervised Learning of Scene Flow Estimation Fusing with Local Rigidity.,4,https://doi.org/10.24963/ijcai.2019/123,https://dblp.org/rec/conf/ijcai/LiuZYL19
514,2019,Edward Lockhart,nan,Karl Tuyls,Google DeepMind,IJCAI,Computing Approximate Equilibria in Sequential Adversarial Games by Exploitability Descent.,7,https://doi.org/10.24963/ijcai.2019/66,https://dblp.org/rec/conf/ijcai/LockhartLPLMTT19
515,2019,Benedikt Loepp,nan,Jürgen Ziegler 0001,"University of Duisburg-Essen, Department of Computer Science and Applied Cognitive Science",IJCAI,Impact of Consuming Suggested Items on the Assessment of Recommendations in User Studies on Recommender Systems.,4,https://doi.org/10.24963/ijcai.2019/863,https://dblp.org/rec/conf/ijcai/LoeppDK019
516,2019,Phani Raj Lolakapuri,nan,Pankaj S. Dayama,nan,IJCAI,Computational Aspects of Equilibria in Discrete Preference Games.,5,https://doi.org/10.24963/ijcai.2019/67,https://dblp.org/rec/conf/ijcai/LolakapuriBNPD19
517,2019,Chong Long,nan,Yafang Wang,nan,IJCAI,CRSRL - Customer Routing System Using Reinforcement Learning.,5,https://doi.org/10.24963/ijcai.2019/952,https://dblp.org/rec/conf/ijcai/LongL0HW19
518,2019,Zhiyun Lu,nan,Fei Sha,"University of Southern California, Los Angeles, USA",IJCAI,Hyper-parameter Tuning under a Budget Constraint.,4,https://doi.org/10.24963/ijcai.2019/796,https://dblp.org/rec/conf/ijcai/LuCCS19
519,2019,Shiyin Lu,nan,Lijun Zhang 0005,张利军,IJCAI,Multi-Objective Generalized Linear Bandits.,4,https://doi.org/10.24963/ijcai.2019/427,https://dblp.org/rec/conf/ijcai/LuWHZ19
520,2019,Jelena Luketina,nan,Tim Rocktäschel,Universitiy College London,IJCAI,A Survey of Reinforcement Learning Informed by Natural Language.,8,https://doi.org/10.24963/ijcai.2019/880,https://dblp.org/rec/conf/ijcai/LuketinaNFFAGWR19
521,2019,Yonghong Luo,nan,Xiaojie Yuan,nan,IJCAI,E²GAN - End-to-End Generative Adversarial Network for Multivariate Time Series Imputation.,4,https://doi.org/10.24963/ijcai.2019/429,https://dblp.org/rec/conf/ijcai/Luo0CY19
522,2019,Ling Luo,nan,Dong Yu,nan,IJCAI,Unsupervised Neural Aspect Extraction with Sememes.,7,https://doi.org/10.24963/ijcai.2019/712,https://dblp.org/rec/conf/ijcai/LuoASLYHY19
523,2019,Chuan Luo,nan,Dongmei Zhang,nan,IJCAI,Local Search with Efficient Automatic Configuration for Minimum Vertex Cover.,6,https://doi.org/10.24963/ijcai.2019/180,https://dblp.org/rec/conf/ijcai/LuoHCLZZ19
524,2019,Kailun Luo,nan,Yongmei Liu 0001,"Sun Yat-sen University, China",IJCAI,Automatic Verification of FSA Strategies via Counterexample-Guided Local Search for Invariants.,2,https://doi.org/10.24963/ijcai.2019/251,https://dblp.org/rec/conf/ijcai/LuoL19
525,2019,Fuli Luo,nan,Zhifang Sui,nan,IJCAI,A Dual Reinforcement Learning Framework for Unsupervised Text Style Transfer.,7,https://doi.org/10.24963/ijcai.2019/711,https://dblp.org/rec/conf/ijcai/LuoLZYCSS19
526,2019,Sihui Luo 0001,"Zhejiang University, China",Mingli Song,nan,IJCAI,Knowledge Amalgamation from Heterogeneous Networks by Common Feature Learning.,6,https://doi.org/10.24963/ijcai.2019/428,https://dblp.org/rec/conf/ijcai/LuoWFHTS19
527,2019,Jiaqi Lv,nan,Xin Geng,nan,IJCAI,Weakly Supervised Multi-Label Learning via Label Enhancement.,4,https://doi.org/10.24963/ijcai.2019/430,https://dblp.org/rec/conf/ijcai/LvXZG19
528,2019,Yuzhe Ma,nan,Justin Hsu,nan,IJCAI,Data Poisoning against Differentially-Private Learners - Attacks and Defenses.,3,https://doi.org/10.24963/ijcai.2019/657,https://dblp.org/rec/conf/ijcai/Ma0H19
529,2019,Xiaobai Ma,nan,Mykel J. Kochenderfer,Stanford University,IJCAI,Monte Carlo Tree Search for Policy Optimization.,4,https://doi.org/10.24963/ijcai.2019/432,https://dblp.org/rec/conf/ijcai/MaDZK19
530,2019,Yuqing Ma,nan,Aishan Liu,nan,IJCAI,Coarse-to-Fine Image Inpainting via Region-wise Convolutions and Non-Local Correlation.,6,https://doi.org/10.24963/ijcai.2019/433,https://dblp.org/rec/conf/ijcai/MaLBWHL19
531,2019,Haojie Ma,nan,Sanglu Lu,nan,IJCAI,AttnSense - Multi-level Attention Mechanism For Multimodal Human Activity Recognition.,5,https://doi.org/10.24963/ijcai.2019/431,https://dblp.org/rec/conf/ijcai/MaLZGL19
532,2019,Jiaqi Ma,nan,Dapeng Tao,nan,IJCAI,Pseudo Supervised Matrix Factorization in Discriminative Subspace.,5,https://doi.org/10.24963/ijcai.2019/633,https://dblp.org/rec/conf/ijcai/MaZZDT19
533,2019,Marco Maier,nan,Christoph Fuchs,nan,IJCAI,DeepFlow - Detecting Optimal User Experience From Physiological Data Using Deep Neural Networks.,5,https://doi.org/10.24963/ijcai.2019/196,https://dblp.org/rec/conf/ijcai/MaierEMZF19
534,2019,Panagiotis Mandros,nan,Jilles Vreeken,"Saarland University, Saarbrücken, Germany",IJCAI,Discovering Reliable Dependencies from Data - Hardness and Improved Algorithms.,3,https://doi.org/10.24963/ijcai.2019/864,https://dblp.org/rec/conf/ijcai/MandrosBV19
535,2019,Masoumeh Mansouri,nan,Federico Pecora,nan,IJCAI,Multi-Robot Planning Under Uncertain Travel Times and Safety Constraints.,4,https://doi.org/10.24963/ijcai.2019/68,https://dblp.org/rec/conf/ijcai/MansouriLHP19
536,2019,Qianren Mao,nan,Lihong Wang,nan,IJCAI,Aspect-Based Sentiment Classification with Attentive Neural Turing Machines.,7,https://doi.org/10.24963/ijcai.2019/714,https://dblp.org/rec/conf/ijcai/MaoLWZPHW19
537,2019,Shunan Mao,nan,Ming Yang 0007,"Facebook AI Research, Menlo Park, CA, USA",IJCAI,Resolution-invariant Person Re-Identification.,3,https://doi.org/10.24963/ijcai.2019/124,https://dblp.org/rec/conf/ijcai/MaoZY19
538,2019,Alberto Marchesi,nan,Nicola Gatti 0001,"Polytechnic University of Milan, Italy",IJCAI,Leadership in Congestion Games - Multiple User Classes and Non-Singleton Actions.,3,https://doi.org/10.24963/ijcai.2019/69,https://dblp.org/rec/conf/ijcai/MarchesiC019
539,2019,Hugo Martin 0002,"Sorbonne Université, CNRS, Laboratoire d'Informatique de Paris 6, LIP6, Paris, France",Patrice Perny,"Sorbonne Université, CNRS, Laboratoire d'Informatique de Paris 6, LIP6, Paris, France",IJCAI,BiOWA for Preference Aggregation with Bipolar Scales - Application to Fair Optimization in Combinatorial Domains.,2,https://doi.org/10.24963/ijcai.2019/252,https://dblp.org/rec/conf/ijcai/MartinP19
540,2019,María del Carmen Fernández Martínez,nan,Alberto Fernández,nan,IJCAI,AI in Recruiting. Multi-agent Systems Architecture for Ethical and Legal Auditing.,2,https://doi.org/10.24963/ijcai.2019/903,https://dblp.org/rec/conf/ijcai/MartinezF19
541,2019,Muhammad A. Masood,nan,Finale Doshi-Velez,"MIT Computer Science and Artificial Intelligence Laboratory, Cambridge, USA",IJCAI,Diversity-Inducing Policy Gradient - Using Maximum Mean Discrepancy to Find a Set of Diverse Policies.,2,https://doi.org/10.24963/ijcai.2019/821,https://dblp.org/rec/conf/ijcai/MasoodD19
