,year,first-author,first-author-affiliation,last-author,last-author-affiliation,journal/conference,title,number-of-authors,paper-url,DBLP-url
759,2019,Siwei Wang,nan,Jianping Yin,nan,IJCAI,Multi-view Clustering via Late Fusion Alignment Maximization.,8,https://doi.org/10.24963/ijcai.2019/524,https://dblp.org/rec/conf/ijcai/WangLZTLHXY19
760,2019,Chun Wang,nan,Chengqi Zhang,"University of Technology Sydney, Centre for Artificial Intelligence, FEIT, Ultimo, NSW, Australia",IJCAI,Attributed Graph Clustering - A Deep Attentional Embedding Approach.,6,https://doi.org/10.24963/ijcai.2019/509,https://dblp.org/rec/conf/ijcai/WangPHLJZ19
761,2019,Jing Wang,nan,Tao Mei 0001,"JD AI Research, Beijing, China",IJCAI,Convolutional Auto-encoding of Sentence Topics for Image Paragraph Generation.,5,https://doi.org/10.24963/ijcai.2019/132,https://dblp.org/rec/conf/ijcai/WangPYTM19
762,2019,Bin Wang 0004,"Xiaomi AI Lab, Beijing, China",Yongdong Zhang 0001,"University of Science and Technology of China, National Engineering Laboratory for Brain-inspired Intelligence Technology an Application, Hefei, China",IJCAI,Boundary Perception Guidance - A Scribble-Supervised Semantic Segmentation Approach.,7,https://doi.org/10.24963/ijcai.2019/508,https://dblp.org/rec/conf/ijcai/WangQTZWLZ19
763,2019,Zihan Wang,nan,Yue Hu,nan,IJCAI,Robust Embedding with Multi-Level Structures for Link Prediction.,5,https://doi.org/10.24963/ijcai.2019/728,https://dblp.org/rec/conf/ijcai/WangRHZH19
764,2019,Jia Wang,nan,Hongwei Zhu,nan,IJCAI,CLVSA - A Convolutional LSTM Based Variational Sequence-to-Sequence Model with Attention for Predicting Trends of Financial Markets.,5,https://doi.org/10.24963/ijcai.2019/514,https://dblp.org/rec/conf/ijcai/WangSLCZ19
765,2019,Zhaodong Wang,nan,Matthew E. Taylor,nan,IJCAI,Interactive Reinforcement Learning with Dynamic Reuse of Prior Knowledge from Human and Agent Demonstrations.,2,https://doi.org/10.24963/ijcai.2019/530,https://dblp.org/rec/conf/ijcai/WangT19
766,2019,Xiao Wang 0028,"Boston University, MA, USA",Sang Peter Chin,"Johns Hopkins University, Baltimore, Department of Electrical and Computer Engineering",IJCAI,Protecting Neural Networks with Hierarchical Random Switching - Towards Better Robustness-Accuracy Trade-off for Stochastic Defenses.,7,https://doi.org/10.24963/ijcai.2019/833,https://dblp.org/rec/conf/ijcai/WangWCWKLC19
767,2019,Hanzhang Wang,nan,Kaisheng Xu,nan,IJCAI,Swell-and-Shrink - Decomposing Image Captioning by Transformation and Summarization.,3,https://doi.org/10.24963/ijcai.2019/726,https://dblp.org/rec/conf/ijcai/WangWX19
768,2019,Yuxin Wang,nan,Yongdong Zhang 0001,"University of Science and Technology of China, National Engineering Laboratory for Brain-inspired Intelligence Technology an Application, Hefei, China",IJCAI,DSRN - A Deep Scale Relationship Network for Scene Text Detection.,4,https://doi.org/10.24963/ijcai.2019/133,https://dblp.org/rec/conf/ijcai/WangXFZ19
769,2019,Jing Wang 0023,"University of Tokyo, Department of Creative Informatics, Japan",Kenji Yamanishi,nan,IJCAI,Attributed Subspace Clustering.,6,https://doi.org/10.24963/ijcai.2019/516,https://dblp.org/rec/conf/ijcai/WangXTSZY19
770,2019,Guan'an Wang,nan,Zeng-Huang Hou,nan,IJCAI,Color-Sensitive Person Re-Identification.,5,https://doi.org/10.24963/ijcai.2019/131,https://dblp.org/rec/conf/ijcai/WangY0WH19
771,2019,Yaxiong Wang,nan,Xin Fan,nan,IJCAI,Position Focused Attention Network for Image-Text Matching.,7,https://doi.org/10.24963/ijcai.2019/526,https://dblp.org/rec/conf/ijcai/WangYQMLLF19
772,2019,Hao Wang 0068,"Southwest Jiaotong University, School of Information Science and Technology, Chengdu, China",Wei Zhou,nan,IJCAI,Spectral Perturbation Meets Incomplete Multi-view Data.,5,https://doi.org/10.24963/ijcai.2019/510,https://dblp.org/rec/conf/ijcai/WangZLYZ19
773,2019,Yutong Wang,nan,Yueting Zhuang,nan,IJCAI,Weak Supervision Enhanced Generative Network for Question Generation.,6,https://doi.org/10.24963/ijcai.2019/528,https://dblp.org/rec/conf/ijcai/WangZLZ0Z19
774,2019,Deli Wang,nan,Zhefeng Gong,nan,IJCAI,Two-Stage Generative Models of Simulating Training Data at The Voxel Level for Large-Scale Microscopy Bioimage Segmentation.,4,https://doi.org/10.24963/ijcai.2019/664,https://dblp.org/rec/conf/ijcai/WangZZG19
775,2019,Nirandika Wanigasekara,nan,David S. Rosenblum,"National University of Singapore, Singapore",IJCAI,Learning Multi-Objective Rewards and User Utility Function in Contextual Bandits for Personalized Ranking.,6,https://doi.org/10.24963/ijcai.2019/532,https://dblp.org/rec/conf/ijcai/WanigasekaraLGL19
776,2019,Yang Wei,nan,Zhong Su,nan,IJCAI,Revealing Semantic Structures of Texts - Multi-grained Framework for Automatic Mind-map Generation.,4,https://doi.org/10.24963/ijcai.2019/729,https://dblp.org/rec/conf/ijcai/WeiGWS19
777,2019,Xingxing Wei,nan,Xiaochun Cao,nan,IJCAI,Transferable Adversarial Attacks for Image and Video Object Detection.,4,https://doi.org/10.24963/ijcai.2019/134,https://dblp.org/rec/conf/ijcai/WeiLCC19
778,2019,Xiguang Wei,nan,Qiang Yang 0001,楊強,IJCAI,Multi-Agent Visualization for Explaining Federated Learning.,6,https://doi.org/10.24963/ijcai.2019/960,https://dblp.org/rec/conf/ijcai/WeiLL0CY19
779,2019,Tong Wei,nan,Yu-Feng Li,nan,IJCAI,Learning for Tail Label Data - A Label-Specific Feature Approach.,3,https://doi.org/10.24963/ijcai.2019/533,https://dblp.org/rec/conf/ijcai/WeiTL19
780,2019,Qingsong Wen,nan,Jian Tan,nan,IJCAI,RobustTrend - A Huber Loss with a Combined First and Second Order Difference Regularization for Time Series Trend Filtering.,5,https://doi.org/10.24963/ijcai.2019/535,https://dblp.org/rec/conf/ijcai/WenGS0T19
781,2019,Jun Wen,nan,Changyou Chen,nan,IJCAI,Bayesian Uncertainty Matching for Unsupervised Domain Adaptation.,5,https://doi.org/10.24963/ijcai.2019/534,https://dblp.org/rec/conf/ijcai/WenZYGC19
782,2019,Rongxiang Weng,nan,Jiajun Chen,nan,IJCAI,Correct-and-Memorize - Learning to Translate from Interactive Revisions.,6,https://doi.org/10.24963/ijcai.2019/730,https://dblp.org/rec/conf/ijcai/WengZHLXC19
783,2019,Paul Wild,nan,Barbara König 0001,"University of Duisburg-Essen, Department of Computer Science and Applied Cognitive Science",IJCAI,A Modal Characterization Theorem for a Probabilistic Fuzzy Description Logic.,4,https://doi.org/10.24963/ijcai.2019/263,https://dblp.org/rec/conf/ijcai/WildSP019
784,2019,Bryan Wilder,nan,Bryan Wilder,nan,IJCAI,"AI at the Margins - Data, Decisions, and Inclusive Social Impact.",1,https://doi.org/10.24963/ijcai.2019/926,https://dblp.org/rec/conf/ijcai/Wilder19
785,2019,Chayut Wiwatcharakoses,nan,Daniel Berrar,"Tokyo Institute of Technology, Interdisciplinary Graduate School of Science and Engineering",IJCAI,Self-Organizing Incremental Neural Networks for Continual Learning.,2,https://doi.org/10.24963/ijcai.2019/927,https://dblp.org/rec/conf/ijcai/Wiwatcharakoses19
786,2019,Huijun Wu 0001,"University of New South Wales, School of Computer Science and Engineering, Sydney, Australia",Liming Zhu,nan,IJCAI,Adversarial Examples for Graph Data - Deep Insights into Attack and Defense.,6,https://doi.org/10.24963/ijcai.2019/669,https://dblp.org/rec/conf/ijcai/Wu0TDLZ19
787,2019,Yongkai Wu,nan,Xintao Wu,nan,IJCAI,"Counterfactual Fairness - Unidentification, Bound and Algorithm.",3,https://doi.org/10.24963/ijcai.2019/199,https://dblp.org/rec/conf/ijcai/Wu0W19
788,2019,Lianlong Wu,nan,Lianlong Wu,nan,IJCAI,Evolutionary Learning of Existential Rules.,1,https://doi.org/10.24963/ijcai.2019/928,https://dblp.org/rec/conf/ijcai/Wu19
789,2019,Xuan Wu 0003,"Alibaba Group, Hangzhou, China",Min-Ling Zhang,nan,IJCAI,Multi-View Multi-Label Learning with View-Specific Information Extraction.,7,https://doi.org/10.24963/ijcai.2019/539,https://dblp.org/rec/conf/ijcai/WuCHWCWZ19
790,2019,Le Wu,nan,Meng Wang 0001,"Hefei University of Technology, China",IJCAI,Personalized Multimedia Item and Key Frame Recommendation.,7,https://doi.org/10.24963/ijcai.2019/198,https://dblp.org/rec/conf/ijcai/WuCYHGXW19
791,2019,Aming Wu,nan,Yi Yang 0001,"University of Technology Sydney, Centre for Quantum Computation and Intelligent Systems, NSW, Australia",IJCAI,Video Interactive Captioning with Human Prompts.,3,https://doi.org/10.24963/ijcai.2019/135,https://dblp.org/rec/conf/ijcai/WuH019
792,2019,Qitian Wu,nan,Guihai Chen,"Shanghai Jiao Tong University, China",IJCAI,Feature Evolution Based Multi-Task Learning for Collaborative Filtering with Social Trust.,5,https://doi.org/10.24963/ijcai.2019/538,https://dblp.org/rec/conf/ijcai/WuJG0C19
793,2019,Yuting Wu,nan,Dongyan Zhao 0001,"Peking University, Institute of Computer Science and Technology, China",IJCAI,Relation-Aware Entity Alignment for Heterogeneous Knowledge Graphs.,6,https://doi.org/10.24963/ijcai.2019/733,https://dblp.org/rec/conf/ijcai/WuLF0Y019
794,2019,Yongji Wu,nan,Enhong Chen,"University of Science and Technology of China, School of Computer Science and Technology, Anhui Province Key Laboratory of Big Data Analysis and Application, Hefei, China",IJCAI,Graph Convolutional Networks on User Mobility Heterogeneous Graphs for Social Relationship Inference.,4,https://doi.org/10.24963/ijcai.2019/541,https://dblp.org/rec/conf/ijcai/WuLJC19
795,2019,Qiong Wu 0001,"Nanyang Technological University, School of Computer Engineering, Singapore",Lu Guan,nan,IJCAI,PD-GAN - Adversarial Learning for Personalized Diversity-Promoting Recommendation.,6,https://doi.org/10.24963/ijcai.2019/537,https://dblp.org/rec/conf/ijcai/WuLMZZG19
796,2019,Haoze Wu 0003,"University of Science and Technology of China, National Engineering Laboratory for Brain-inspired Intelligence Technology and Application, Hefei, China",Xiaoyan Sun,nan,IJCAI,Mutually Reinforced Spatio-Temporal Convolutional Tube for Human Action Recognition.,5,https://doi.org/10.24963/ijcai.2019/136,https://dblp.org/rec/conf/ijcai/WuLZCS19
797,2019,Zonghan Wu,nan,Chengqi Zhang,"University of Technology Sydney, Centre for Artificial Intelligence, FEIT, Ultimo, NSW, Australia",IJCAI,Graph WaveNet for Deep Spatial-Temporal Graph Modeling.,5,https://doi.org/10.24963/ijcai.2019/264,https://dblp.org/rec/conf/ijcai/WuPLJZ19
798,2019,Yuechen Wu,nan,Zheng-Jun Zha,nan,IJCAI,Exploring the Task Cooperation in Multi-goal Visual Navigation.,6,https://doi.org/10.24963/ijcai.2019/86,https://dblp.org/rec/conf/ijcai/WuRZLLZ19
799,2019,Chuhan Wu,nan,Xing Xie 0001,谢幸,IJCAI,Neural News Recommendation with Attentive Multi-View Learning.,6,https://doi.org/10.24963/ijcai.2019/536,https://dblp.org/rec/conf/ijcai/WuWAHHX19
800,2019,Xunxian Wu,nan,Hui Xiong 0001,"Microsoft Research Asia, Beijing, China",IJCAI,Trend-Aware Tensor Factorization for Job Skill Demand Analysis.,6,https://doi.org/10.24963/ijcai.2019/540,https://dblp.org/rec/conf/ijcai/WuXZZCX19
801,2019,Junshuang Wu,nan,Jinpeng Huai,nan,IJCAI,Modeling Noisy Hierarchical Types in Fine-Grained Entity Typing - A Content-Based Weighting Approach.,5,https://doi.org/10.24963/ijcai.2019/731,https://dblp.org/rec/conf/ijcai/WuZMGH19
802,2019,Siying Wu,nan,Feng Wu 0001,"Microsoft Research Asia, Beijing, China",IJCAI,Densely Supervised Hierarchical Policy-Value Network for Image Paragraph Generation.,5,https://doi.org/10.24963/ijcai.2019/137,https://dblp.org/rec/conf/ijcai/WuZWLW19
803,2019,Xing Wu,nan,Songlin Hu,nan,IJCAI,Mask and Infill - Applying Masked Language Model for Sentiment Transfer.,5,https://doi.org/10.24963/ijcai.2019/732,https://dblp.org/rec/conf/ijcai/WuZZHH19
804,2019,Wu-Dong Xi,nan,Jianhuang Lai,nan,IJCAI,BPAM - Recommendation Based on BP Neural Network with Attention Mechanism.,5,https://doi.org/10.24963/ijcai.2019/542,https://dblp.org/rec/conf/ijcai/XiHWZL19
805,2019,Jinfu Xia,nan,Kai Zheng 0001,"University of Electronic Science and Technology of China, Chengdu, China",IJCAI,Profit-driven Task Assignment in Spatial Crowdsourcing.,6,https://doi.org/10.24963/ijcai.2019/265,https://dblp.org/rec/conf/ijcai/Xia0LX0019
806,2019,Qi Xia,nan,Qun Li,nan,IJCAI,FABA - An Algorithm for Fast Aggregation against Byzantine Attacks in Distributed Neural Networks.,4,https://doi.org/10.24963/ijcai.2019/670,https://dblp.org/rec/conf/ijcai/XiaTHL19
807,2019,Rui Xia,nan,Zixiang Ding,nan,IJCAI,RTHN - A RNN-Transformer Hierarchical Network for Emotion Cause Extraction.,3,https://doi.org/10.24963/ijcai.2019/734,https://dblp.org/rec/conf/ijcai/XiaZD19
808,2019,Liuyu Xiang,nan,Leida Li,nan,IJCAI,Incremental Few-Shot Learning for Pedestrian Attribute Recognition.,5,https://doi.org/10.24963/ijcai.2019/543,https://dblp.org/rec/conf/ijcai/XiangJDHL19
809,2019,Rong Xiao 0001,"Sichuan University, Chengdu, China",Huajin Tang,nan,IJCAI,Fast and Accurate Classification with a Multi-Spike Learning Algorithm for Spiking Neurons.,4,https://doi.org/10.24963/ijcai.2019/200,https://dblp.org/rec/conf/ijcai/Xiao0YT19
810,2019,Tong Xiao,nan,Tongran Liu,nan,IJCAI,Sharing Attention Weights for Fast Transformer.,5,https://doi.org/10.24963/ijcai.2019/735,https://dblp.org/rec/conf/ijcai/XiaoLZ0L19
811,2019,Sang Michael Xie,nan,Stefano Ermon,Stanford University,IJCAI,Reparameterizable Subset Sampling via Continuous Relaxations.,2,https://doi.org/10.24963/ijcai.2019/544,https://dblp.org/rec/conf/ijcai/XieE19
812,2019,Zhipeng Xie,nan,Feiteng Mu,nan,IJCAI,Boosting Causal Embeddings via Potential Verb-Mediated Causal Patterns.,2,https://doi.org/10.24963/ijcai.2019/266,https://dblp.org/rec/conf/ijcai/XieM19
813,2019,Zhongbin Xie,nan,Shuai Ma 0001,"Beihang University, School of Computer Science and Engineering, China",IJCAI,Dual-View Variational Autoencoders for Semi-Supervised Text Matching.,2,https://doi.org/10.24963/ijcai.2019/737,https://dblp.org/rec/conf/ijcai/XieM19a
814,2019,Xiaofei Xie,nan,Xiaohong Li 0001,"Tianjin University, College of Intelligence and Computing, Institute of Software and Information Security Engineering, Tianjin, China",IJCAI,DiffChaser - Detecting Disagreements for Deep Neural Networks.,6,https://doi.org/10.24963/ijcai.2019/800,https://dblp.org/rec/conf/ijcai/XieMWLLL19
815,2019,Zhipeng Xie,nan,Shichao Sun,nan,IJCAI,A Goal-Driven Tree-Structured Neural Model for Math Word Problems.,2,https://doi.org/10.24963/ijcai.2019/736,https://dblp.org/rec/conf/ijcai/XieS19
816,2019,Peichen Xie,nan,Guangyu Sun 0003,"Peking University, Center for Energy-efficient Computing and Applications, Beijing, China",IJCAI,BAYHENN - Combining Bayesian Deep Learning and Homomorphic Encryption for Secure DNN Inference.,3,https://doi.org/10.24963/ijcai.2019/671,https://dblp.org/rec/conf/ijcai/XieW019
817,2019,Xin Xin,nan,Joemon Jose,nan,IJCAI,CFM - Convolutional Factorization Machines for Context-Aware Recommendation.,6,https://doi.org/10.24963/ijcai.2019/545,https://dblp.org/rec/conf/ijcai/XinCHWDJ19
818,2019,Bowen Xing,nan,Heyan Huang,nan,IJCAI,Earlier Attention? Aspect-Aware LSTM for Aspect-Based Sentiment Analysis.,7,https://doi.org/10.24963/ijcai.2019/738,https://dblp.org/rec/conf/ijcai/XingLSWZWH19
819,2019,Fan Xiong,nan,Jianliang Gao,nan,IJCAI,Entity Alignment for Cross-lingual Knowledge Graph with Graph Convolutional Networks.,2,https://doi.org/10.24963/ijcai.2019/929,https://dblp.org/rec/conf/ijcai/XiongG19
820,2019,Shengbin Xu,nan,Jian Lu 0001,"Nanjing University, Department of Computer Science and Technology / State Key Laboratory for Novel Software Technology, China",IJCAI,Commit Message Generation for Source Code Changes.,6,https://doi.org/10.24963/ijcai.2019/552,https://dblp.org/rec/conf/ijcai/Xu00GT019
821,2019,Yichong Xu,nan,Nihar B. Shah,nan,IJCAI,On Strategyproof Conference Peer Review.,4,https://doi.org/10.24963/ijcai.2019/87,https://dblp.org/rec/conf/ijcai/Xu0SS19
822,2019,Kaidi Xu,nan,Xue Lin,nan,IJCAI,Topology Attack and Defense for Graph Neural Networks - An Optimization Perspective.,7,https://doi.org/10.24963/ijcai.2019/550,https://dblp.org/rec/conf/ijcai/XuC0CWHL19
823,2019,Dongkuan Xu,nan,Xiang Zhang 0001,"Pennsylvania State University, University Park, PA, USA",IJCAI,Spatio-Temporal Attentive RNN for Node Classification in Temporal Attributed Graphs.,5,https://doi.org/10.24963/ijcai.2019/548,https://dblp.org/rec/conf/ijcai/XuCLL019
824,2019,Xinyi Xu,nan,Cheng Deng,nan,IJCAI,Zero-shot Metric Learning.,5,https://doi.org/10.24963/ijcai.2019/555,https://dblp.org/rec/conf/ijcai/XuCYYD19
825,2019,Cai Xu,nan,Beilei Ling,nan,IJCAI,Adversarial Incomplete Multi-view Clustering.,6,https://doi.org/10.24963/ijcai.2019/546,https://dblp.org/rec/conf/ijcai/XuGZWNL19
826,2019,Ruiqing Xu,nan,Xianglong Liu,nan,IJCAI,Graph Convolutional Network Hashing for Cross-Modal Retrieval.,5,https://doi.org/10.24963/ijcai.2019/138,https://dblp.org/rec/conf/ijcai/XuLYDL19
827,2019,Han Xu,nan,Jiayi Ma 0001,马佳义,IJCAI,Learning a Generative Model for Fusing Infrared and Visible Images via Conditional Generative Adversarial Network with Dual Discriminators.,5,https://doi.org/10.24963/ijcai.2019/549,https://dblp.org/rec/conf/ijcai/XuLYJ019
828,2019,Chang Xu 0008,"Microsoft Research Asia, Beijing, China",Tie-Yan Liu,Microsoft Research,IJCAI,Polygon-Net - A General Framework for Jointly Boosting Multiple Unsupervised Neural Machine Translation Models.,4,https://doi.org/10.24963/ijcai.2019/739,https://dblp.org/rec/conf/ijcai/XuQWL19
829,2019,Bingbing Xu,nan,Xueqi Cheng,nan,IJCAI,Graph Convolutional Networks using Heat Kernel for Semi-supervised Learning.,5,https://doi.org/10.24963/ijcai.2019/267,https://dblp.org/rec/conf/ijcai/XuSCCC19
830,2019,Suping Xu,nan,Furao Shen,Nanjing University,IJCAI,Latent Semantics Encoding for Label Distribution Learning.,3,https://doi.org/10.24963/ijcai.2019/553,https://dblp.org/rec/conf/ijcai/XuSS19
831,2019,Xiaofeng Xu,nan,Chuancai Liu,nan,IJCAI,Learning Image-Specific Attributes by Hyperbolic Neighborhood Graph Propagation.,5,https://doi.org/10.24963/ijcai.2019/554,https://dblp.org/rec/conf/ijcai/XuTCZL19
832,2019,Nuo Xu,nan,Junzhou Zhao,nan,IJCAI,MR-GNN - Multi-Resolution and Dual Graph Neural Network for Predicting Structured Entity Interactions.,5,https://doi.org/10.24963/ijcai.2019/551,https://dblp.org/rec/conf/ijcai/XuWCTZ19
833,2019,Depeng Xu,nan,Xintao Wu,nan,IJCAI,Achieving Causal Fairness through Generative Adversarial Networks.,5,https://doi.org/10.24963/ijcai.2019/201,https://dblp.org/rec/conf/ijcai/XuWYZW19
834,2019,Yi Xu,nan,Tianbao Yang,nan,IJCAI,On the Convergence of (Stochastic) Gradient Descent with Extrapolation for Non-Convex Minimization.,5,https://doi.org/10.24963/ijcai.2019/556,https://dblp.org/rec/conf/ijcai/XuYYJY19
835,2019,Haofei Xu,nan,Juyong Zhang,nan,IJCAI,Region Deformer Networks for Unsupervised Depth Estimation from Unconstrained Monocular Videos.,4,https://doi.org/10.24963/ijcai.2019/788,https://dblp.org/rec/conf/ijcai/XuZCZ19
836,2019,Chengfeng Xu,nan,Xiaofang Zhou 0001,周晓方,IJCAI,Graph Contextualized Self-Attention Network for Session-based Recommendation.,8,https://doi.org/10.24963/ijcai.2019/547,https://dblp.org/rec/conf/ijcai/XuZLSXZFZ19
837,2019,Yanan Xu,nan,Jiadi Yu,"Shanghai Jiao Tong University, Department of Computer Science and Engineering, Shanghai, China",IJCAI,Learning Shared Vertex Representation in Heterogeneous Graphs with Convolutional Networks for Recommendation.,4,https://doi.org/10.24963/ijcai.2019/642,https://dblp.org/rec/conf/ijcai/XuZSY19
838,2019,Mengge Xue,nan,Bin Wang 0004,"Xiaomi AI Lab, Beijing, China",IJCAI,Neural Collective Entity Linking Based on Recurrent Random Walk Network Learning.,7,https://doi.org/10.24963/ijcai.2019/740,https://dblp.org/rec/conf/ijcai/XueCSSGLW19
839,2019,Zhe Xue,nan,Siwei Lyu,nan,IJCAI,Deep Correlated Predictive Subspace Learning for Incomplete Multi-View Semi-Supervised Classification.,5,https://doi.org/10.24963/ijcai.2019/559,https://dblp.org/rec/conf/ijcai/XueDDRL19
840,2019,Chuhui Xue,nan,Wei Zhang 0066,"Shandong University, School of Control Science and Engineering, Jinan, China",IJCAI,MSR - Multi-Scale Shape Regression for Scene Text Detection.,3,https://doi.org/10.24963/ijcai.2019/139,https://dblp.org/rec/conf/ijcai/XueLZ19
841,2019,Hui Xue,nan,Wei-Xiang Sun,nan,IJCAI,Deep Spectral Kernel Learning.,3,https://doi.org/10.24963/ijcai.2019/558,https://dblp.org/rec/conf/ijcai/XueWS19
842,2019,Hiromu Yakura,nan,Jun Sakuma,nan,IJCAI,Robust Audio Adversarial Example for a Physical Attack.,2,https://doi.org/10.24963/ijcai.2019/741,https://dblp.org/rec/conf/ijcai/YakuraS19
843,2019,Huan Yan,nan,Depeng Jin,nan,IJCAI,DeepAPF - Deep Attentive Probabilistic Factorization for Multi-site Video Recommendation.,5,https://doi.org/10.24963/ijcai.2019/202,https://dblp.org/rec/conf/ijcai/YanCGLJ19
844,2019,Xiyu Yan,nan,Feng Zheng,nan,IJCAI,Automatic Grassland Degradation Estimation Using Deep Learning.,9,https://doi.org/10.24963/ijcai.2019/835,https://dblp.org/rec/conf/ijcai/YanJCHLXDDZ19
845,2019,Shiyang Yan,nan,Lin Xu,nan,IJCAI,HorNet - A Hierarchical Offshoot Recurrent Network for Improving Person Re-ID via Image Captioning.,4,https://doi.org/10.24963/ijcai.2019/742,https://dblp.org/rec/conf/ijcai/YanXLX19
846,2019,Yongjie Yang 0001,"Central South University, School of Information Science and Engineering, Changsha, China",Yongjie Yang 0001,"Central South University, School of Information Science and Engineering, Changsha, China",IJCAI,Complexity of Manipulating and Controlling Approval-Based Multiwinner Voting.,1,https://doi.org/10.24963/ijcai.2019/90,https://dblp.org/rec/conf/ijcai/Yang19
847,2019,Yongjie Yang 0001,"Central South University, School of Information Science and Engineering, Changsha, China",Yongjie Yang 0001,"Central South University, School of Information Science and Engineering, Changsha, China",IJCAI,On the Tree Representations of Dichotomous Preferences.,1,https://doi.org/10.24963/ijcai.2019/91,https://dblp.org/rec/conf/ijcai/Yang19a
848,2019,Yinfei Yang,nan,Ray Kurzweil,National Medal of Technology and Innovation,IJCAI,Improving Multilingual Sentence Embedding using Bi-directional Dual Encoder with Additive Margin Softmax.,9,https://doi.org/10.24963/ijcai.2019/746,https://dblp.org/rec/conf/ijcai/YangAYGSCSSK19
849,2019,Chengcheng Yang,nan,Ling Shao 0001,"Inception Institute of Artificial Intelligence (IIAI), Abu Dhabi, UAE",IJCAI,Toward Efficient Navigation of Massive-Scale Geo-Textual Streams.,6,https://doi.org/10.24963/ijcai.2019/672,https://dblp.org/rec/conf/ijcai/YangCS0L019
850,2019,Yao Yang,nan,Junming Shao,nan,IJCAI,Triplet Enhanced AutoEncoder - Model-free Discriminative Network Embedding.,3,https://doi.org/10.24963/ijcai.2019/745,https://dblp.org/rec/conf/ijcai/YangCS19
851,2019,Ke Yang,nan,Julia Stoyanovich,"New York University, NY, USA",IJCAI,Balanced Ranking with Diversity Constraints.,3,https://doi.org/10.24963/ijcai.2019/836,https://dblp.org/rec/conf/ijcai/YangGS19
852,2019,Tianpei Yang,nan,Ze Zheng,nan,IJCAI,Towards Efficient Detection and Optimal Response against Sophisticated Opponents.,6,https://doi.org/10.24963/ijcai.2019/88,https://dblp.org/rec/conf/ijcai/YangHMZZZ19
853,2019,Yaodong Yang,nan,Chao Yu,nan,IJCAI,Large-Scale Home Energy Management Using Entropy-Based Collective Multiagent Deep Reinforcement Learning Framework.,4,https://doi.org/10.24963/ijcai.2019/89,https://dblp.org/rec/conf/ijcai/YangHZY19
854,2019,Wenmian Yang,nan,Yutao Luo,nan,IJCAI,Legal Judgment Prediction via Multi-Perspective Bi-Feedback Network.,4,https://doi.org/10.24963/ijcai.2019/567,https://dblp.org/rec/conf/ijcai/YangJZL19
855,2019,Pengcheng Yang,nan,Xu Sun 0001,"Peking University, School of EECS, MOE Key Lab of Computational Linguistics, China",IJCAI,Knowledgeable Storyteller - A Commonsense-Driven Generative Model for Visual Storytelling.,7,https://doi.org/10.24963/ijcai.2019/744,https://dblp.org/rec/conf/ijcai/YangLCLYHS19
856,2019,Haoxuan Yang,nan,Feiping Nie 0001,"Northwestern Polytechnical University, School of Computer Science, OPTIMAL, Xi'an, China",IJCAI,Learning Strictly Orthogonal p-Order Nonnegative Laplacian Embedding via Smoothed Iterative Reweighted Method.,4,https://doi.org/10.24963/ijcai.2019/561,https://dblp.org/rec/conf/ijcai/YangLWN19
857,2019,Hong Yang,nan,Peng Zhang 0001,"University of Technology Sydney, Research Center on Quantum Computation and Intelligent Systems, Sydney, Australia",IJCAI,Low-Bit Quantization for Attributed Network Representation Learning.,5,https://doi.org/10.24963/ijcai.2019/562,https://dblp.org/rec/conf/ijcai/YangP0Z019
858,2019,Cheng Yang 0002,"Beijing University of Posts and Telecommunications, China",Zhiyuan Liu 0001,"Tsinghua University, Beijing, China",IJCAI,Multi-scale Information Diffusion Prediction with Reinforced Recurrent Networks.,5,https://doi.org/10.24963/ijcai.2019/560,https://dblp.org/rec/conf/ijcai/YangTSC019
859,2019,Pei Yang 0001,"South China University of Technology, Guangzhou, China",Jingrui He,nan,IJCAI,Deep Multi-Task Learning with Adversarial-and-Cooperative Nets.,5,https://doi.org/10.24963/ijcai.2019/566,https://dblp.org/rec/conf/ijcai/YangTYTH19
860,2019,Shihui Yang,nan,Yaohui Jin,nan,IJCAI,TransMS - Knowledge Graph Embedding for Complex Relations by Multidirectional Semantics.,6,https://doi.org/10.24963/ijcai.2019/268,https://dblp.org/rec/conf/ijcai/YangTZYHJ19
861,2019,Aiping Yang,nan,Ling Shao 0001,"Inception Institute of Artificial Intelligence (IIAI), Abu Dhabi, UAE",IJCAI,Dual-Path in Dual-Path Network for Single Image Dehazing.,5,https://doi.org/10.24963/ijcai.2019/643,https://dblp.org/rec/conf/ijcai/YangWJP019
862,2019,Yiding Yang,nan,Dacheng Tao,"University of Sydney, UBTECH Sydney Artificial Intelligence Centre, Darlington, Australia",IJCAI,SPAGAN - Shortest Path Graph Attention Network.,5,https://doi.org/10.24963/ijcai.2019/569,https://dblp.org/rec/conf/ijcai/YangWSYT19
863,2019,Yang Yang 0074,"Nanjing University, National Key Laboratory for Novel Software Technology, China",Yuan Jiang 0001,"Nanjing University, National Key Laboratory for Novel Software Technology, China",IJCAI,Comprehensive Semi-Supervised Multi-Modal Learning.,5,https://doi.org/10.24963/ijcai.2019/568,https://dblp.org/rec/conf/ijcai/YangWZX019
